6958,in sagittis dui vel,1,2022-03-04
6959,vel nulla eget eros elementum pellentesque,2,2022-10-25
6960,eu interdum eu tincidunt in,1,2022-10-24
6961,quis orci nullam molestie,4,2022-05-31
6962,vestibulum sagittis sapien cum,4,2022-05-18
6963,iaculis diam erat fermentum,5,2022-03-17
6964,justo in blandit ultrices enim lorem,4,2022-06-05
6965,vulputate elementum nullam varius nulla facilisi,1,2022-01-03
6966,ante nulla justo aliquam quis turpis,2,2022-04-05
6967,cum sociis natoque penatibus et magnis,4,2022-05-09
6968,vestibulum sagittis sapien cum sociis,4,2022-01-12
6969,et ultrices posuere cubilia curae nulla,1,2022-05-20
6970,ultrices libero non mattis pulvinar nulla,1,2022-07-15
6971,turpis integer aliquet massa,2,2021-11-16
6972,nulla facilisi cras non velit,5,2022-11-01
6973,in purus eu magna vulputate luctus,4,2022-02-03
6974,odio cras mi pede malesuada,1,2022-03-19
6975,quis augue luctus tincidunt nulla mollis,3,2021-12-16
6976,gravida sem praesent id massa id,1,2021-12-08
6977,nec nisi volutpat eleifend,5,2022-07-30
6978,sit amet lobortis sapien sapien non,2,2022-06-21
6979,pede lobortis ligula sit,5,2022-10-22
6980,lacus at turpis donec posuere metus,2,2022-03-05
6981,elementum nullam varius nulla facilisi,1,2022-04-26
6982,erat tortor sollicitudin mi sit amet,3,2022-09-09
6983,curae duis faucibus accumsan odio curabitur,4,2022-09-16
6984,quis orci nullam molestie nibh,3,2022-07-10
6985,risus dapibus augue vel accumsan tellus,1,2022-07-01
6986,felis donec semper sapien,4,2022-09-30
6987,nisi venenatis tristique fusce,2,2022-05-02
6988,vestibulum vestibulum ante ipsum primis,5,2022-03-23
6989,risus dapibus augue vel,4,2022-09-25
6990,sed nisl nunc rhoncus dui vel,5,2022-09-17
6991,eget vulputate ut ultrices vel augue,3,2022-06-24
6992,vitae nisl aenean lectus pellentesque,2,2022-05-22
6993,augue vestibulum ante ipsum primis,4,2022-06-18
6994,eleifend pede libero quis,5,2022-09-14
6995,magna vestibulum aliquet ultrices erat tortor,3,2022-07-17
6996,rhoncus aliquam lacus morbi,5,2022-05-22
6997,porta volutpat quam pede,3,2021-12-12
6998,justo sollicitudin ut suscipit a feugiat,5,2021-12-02
6999,eget eleifend luctus ultricies,1,2022-06-28
7000,potenti nullam porttitor lacus at,1,2021-12-10
7001,rutrum at lorem integer tincidunt ante,3,2021-11-19
7002,commodo vulputate justo in,3,2022-07-03
7003,tincidunt ante vel ipsum praesent,4,2022-07-17
7004,auctor gravida sem praesent id massa,1,2022-03-14
7005,mauris eget massa tempor convallis nulla,1,2021-12-28
7006,etiam faucibus cursus urna ut,2,2021-11-09
7007,tellus nulla ut erat,1,2021-12-18
7008,imperdiet nullam orci pede venenatis non,4,2022-02-17
7009,in sapien iaculis congue vivamus,5,2022-07-09
7010,augue a suscipit nulla elit ac,1,2022-05-08
7011,enim leo rhoncus sed vestibulum,4,2021-11-19
7012,faucibus cursus urna ut tellus nulla,5,2021-11-30
7013,eget tempus vel pede,1,2022-08-14
7014,rutrum nulla nunc purus phasellus,2,2022-02-22
7015,et tempus semper est quam,2,2022-04-19
7016,sed tristique in tempus sit amet,1,2022-07-04
7017,nulla ut erat id mauris,3,2022-03-12
7018,amet diam in magna bibendum imperdiet,4,2022-01-09
7019,at diam nam tristique tortor eu,3,2022-04-26
7020,pede venenatis non sodales,1,2022-07-20
7021,luctus rutrum nulla tellus,1,2022-04-22
7022,velit nec nisi vulputate nonummy,1,2021-11-14
7023,ligula vehicula consequat morbi a ipsum,4,2022-07-02
7024,eget eleifend luctus ultricies eu,3,2022-10-08
7025,nulla neque libero convallis eget eleifend,5,2022-09-07
7026,ut blandit non interdum in,2,2022-01-22
7027,sollicitudin vitae consectetuer eget rutrum at,5,2022-05-13
7028,purus eu magna vulputate luctus cum,3,2022-05-14
7029,donec quis orci eget orci,2,2021-11-16
7030,ipsum primis in faucibus orci luctus,1,2022-09-28
7031,neque libero convallis eget eleifend,5,2022-03-17
7032,semper porta volutpat quam pede,4,2022-08-05
7033,in est risus auctor sed tristique,2,2022-05-21
7034,vel ipsum praesent blandit lacinia,2,2021-11-27
7035,vestibulum rutrum rutrum neque aenean auctor,3,2022-01-16
7036,proin eu mi nulla ac,2,2022-04-07
7037,justo lacinia eget tincidunt,5,2022-09-13
7038,ligula nec sem duis aliquam,4,2022-09-13
7039,pede posuere nonummy integer non velit,5,2022-01-11
7040,amet turpis elementum ligula,1,2022-01-11
7041,hendrerit at vulputate vitae nisl,1,2022-10-11
7042,cubilia curae mauris viverra diam,4,2022-06-30
7043,odio odio elementum eu interdum eu,4,2022-03-17
7044,ut tellus nulla ut erat id,3,2022-04-29
7045,purus phasellus in felis donec,1,2021-11-06
7046,mauris sit amet eros suspendisse accumsan,2,2022-10-04
7047,in libero ut massa volutpat,5,2022-01-08
7048,morbi vel lectus in quam fringilla,4,2022-05-29
7049,at dolor quis odio,4,2022-04-13
7050,diam id ornare imperdiet sapien,3,2021-11-20
7051,maecenas pulvinar lobortis est phasellus sit,5,2021-11-17
7052,aliquam augue quam sollicitudin vitae consectetuer,3,2022-02-22
7053,nascetur ridiculus mus vivamus vestibulum sagittis,3,2022-05-23
7054,convallis eget eleifend luctus ultricies eu,1,2022-09-29
7055,turpis a pede posuere,5,2022-06-09
7056,in libero ut massa,4,2022-02-25
7057,leo odio porttitor id consequat,4,2022-05-18
7058,aliquam lacus morbi quis tortor id,2,2022-05-04
7059,quam pede lobortis ligula,1,2021-12-19
7060,massa tempor convallis nulla,3,2022-10-28
7061,felis fusce posuere felis,5,2022-09-29
7062,semper est quam pharetra magna ac,5,2022-09-20
7063,a suscipit nulla elit,3,2022-07-14
7064,diam cras pellentesque volutpat,2,2022-01-15
7065,nibh in hac habitasse platea dictumst,4,2022-09-07
7066,quam fringilla rhoncus mauris,3,2021-12-05
7067,montes nascetur ridiculus mus etiam vel,4,2022-02-27
7068,arcu adipiscing molestie hendrerit at,4,2022-09-06
7069,lacus curabitur at ipsum ac tellus,2,2022-06-21
7070,ultrices aliquet maecenas leo odio condimentum,5,2022-07-12
7071,lectus suspendisse potenti in eleifend,1,2022-06-27
7072,eget rutrum at lorem integer tincidunt,3,2022-05-18
7073,morbi a ipsum integer,4,2022-01-05
7074,ac consequat metus sapien ut,3,2021-12-30
7075,viverra eget congue eget semper,4,2021-11-11
7076,vulputate ut ultrices vel,2,2022-03-03
7077,potenti nullam porttitor lacus at turpis,4,2022-05-26
7078,leo rhoncus sed vestibulum sit amet,2,2022-09-27
7079,at dolor quis odio consequat varius,1,2022-09-05
7080,curabitur at ipsum ac,4,2022-06-13
7081,pede ac diam cras,2,2022-10-28
7082,sit amet diam in magna bibendum,5,2022-10-28
7083,faucibus orci luctus et ultrices posuere,1,2021-11-29
7084,felis sed lacus morbi sem mauris,5,2021-11-04
7085,elit sodales scelerisque mauris,3,2022-09-20
7086,ac consequat metus sapien ut nunc,4,2022-02-01
7087,metus aenean fermentum donec ut,3,2022-07-10
7088,sit amet consectetuer adipiscing,2,2022-04-19
7089,vestibulum rutrum rutrum neque,2,2021-12-27
7090,semper interdum mauris ullamcorper purus sit,5,2022-10-27
7091,cum sociis natoque penatibus et,5,2022-03-29
7092,pharetra magna ac consequat metus sapien,2,2022-06-24
7093,pretium nisl ut volutpat,4,2022-10-14
7094,euismod scelerisque quam turpis,4,2022-01-07
7095,sapien placerat ante nulla justo aliquam,2,2022-08-31
7096,adipiscing molestie hendrerit at vulputate vitae,3,2022-04-29
7097,quam fringilla rhoncus mauris,4,2022-03-28
7098,nullam varius nulla facilisi cras non,1,2022-09-28
7099,massa tempor convallis nulla neque libero,5,2022-01-05
7100,nisi vulputate nonummy maecenas tincidunt,3,2021-11-06
7101,luctus cum sociis natoque,3,2022-06-09
7102,nunc commodo placerat praesent blandit nam,2,2022-09-25
7103,integer a nibh in quis,5,2021-11-20
7104,erat vestibulum sed magna at nunc,5,2022-01-24
7105,convallis eget eleifend luctus,3,2022-10-07
7106,in est risus auctor sed tristique,4,2022-03-04
7107,lacinia eget tincidunt eget tempus vel,2,2021-11-20
7108,nec condimentum neque sapien placerat,4,2022-09-23
7109,aenean auctor gravida sem,2,2022-02-28
7110,aliquam convallis nunc proin at,2,2022-01-18
7111,id luctus nec molestie,5,2021-12-13
7112,odio cras mi pede,1,2022-09-16
7113,sit amet lobortis sapien,2,2022-10-30
7114,integer non velit donec,4,2021-12-31
7115,id turpis integer aliquet massa id,3,2022-03-20
7116,pulvinar sed nisl nunc rhoncus dui,3,2022-03-28
7117,a suscipit nulla elit ac,4,2022-08-21
7118,erat tortor sollicitudin mi,5,2022-06-25
7119,aenean sit amet justo morbi,3,2022-05-31
7120,bibendum imperdiet nullam orci,3,2022-03-23
7121,vestibulum sagittis sapien cum sociis natoque,5,2022-05-18
7122,ut massa volutpat convallis,5,2022-09-09
7123,tellus semper interdum mauris ullamcorper,2,2022-05-30
7124,sed magna at nunc commodo placerat,3,2022-05-09
7125,nisi venenatis tristique fusce congue,4,2022-09-21
7126,pretium nisl ut volutpat sapien arcu,2,2022-01-13
7127,sapien sapien non mi,4,2021-11-11
7128,accumsan tellus nisi eu orci mauris,3,2021-11-20
7129,duis consequat dui nec nisi,2,2021-12-07
7130,sapien ut nunc vestibulum ante,4,2022-05-07
7131,nec dui luctus rutrum,2,2022-09-21
7132,at nulla suspendisse potenti,1,2022-01-25
7133,nulla elit ac nulla sed,3,2021-12-01
7134,amet consectetuer adipiscing elit,2,2022-04-25
7135,convallis eget eleifend luctus,1,2022-09-10
7136,diam vitae quam suspendisse potenti nullam,2,2022-02-11
7137,massa volutpat convallis morbi,4,2022-02-11
7138,semper sapien a libero nam,1,2022-06-13
7139,ante vestibulum ante ipsum,3,2021-12-03
7140,dapibus duis at velit eu,4,2022-09-11
7141,vitae mattis nibh ligula nec sem,4,2021-11-14
7142,vestibulum ante ipsum primis in,2,2021-11-20
7143,sodales sed tincidunt eu felis,5,2022-05-21
7144,rhoncus aliquet pulvinar sed,4,2021-12-22
7145,amet consectetuer adipiscing elit proin interdum,1,2022-04-09
7146,ac neque duis bibendum morbi non,5,2022-10-18
7147,nulla quisque arcu libero rutrum ac,4,2021-12-15
7148,donec quis orci eget orci vehicula,3,2022-10-19
7149,nulla neque libero convallis,5,2021-11-14
7150,faucibus cursus urna ut tellus,1,2022-04-14
7151,ultrices erat tortor sollicitudin mi,4,2022-01-25
7152,ipsum primis in faucibus orci luctus,4,2022-03-17
7153,venenatis turpis enim blandit mi in,5,2022-02-10
7154,in tempor turpis nec,4,2022-01-31
7155,platea dictumst etiam faucibus cursus,1,2022-04-27
7156,scelerisque mauris sit amet,5,2022-08-20
7157,velit eu est congue elementum,5,2022-08-30
7158,sollicitudin mi sit amet lobortis,5,2022-03-05
7159,blandit non interdum in ante vestibulum,2,2022-07-28
7160,turpis donec posuere metus vitae ipsum,2,2022-10-18
7161,quam turpis adipiscing lorem vitae,2,2022-07-19
7162,platea dictumst etiam faucibus cursus urna,4,2021-11-08
7163,tellus semper interdum mauris,2,2022-03-24
7164,odio condimentum id luctus nec,5,2022-01-16
7165,nonummy integer non velit donec diam,2,2022-03-02
7166,sit amet consectetuer adipiscing elit,3,2022-01-10
7167,amet lobortis sapien sapien non mi,3,2022-10-14
7168,nisi eu orci mauris lacinia sapien,5,2022-09-07
7169,in porttitor pede justo eu,2,2022-06-02
7170,convallis nulla neque libero convallis eget,1,2022-01-04
7171,ut massa quis augue luctus tincidunt,3,2022-01-25
7172,vivamus metus arcu adipiscing,2,2022-04-19
7173,pretium nisl ut volutpat,5,2021-12-09
7174,tellus semper interdum mauris,1,2022-09-22
7175,rhoncus aliquam lacus morbi,3,2022-04-15
7176,in tempus sit amet,5,2022-03-29
7177,at nibh in hac,1,2022-08-26
7178,vulputate justo in blandit ultrices,5,2022-09-17
7179,quisque arcu libero rutrum ac,3,2022-08-12
7180,adipiscing elit proin risus praesent lectus,1,2021-12-07
7181,tristique est et tempus semper,3,2022-09-08
7182,eget nunc donec quis orci,1,2022-04-24
7183,sapien non mi integer ac neque,5,2022-02-07
7184,sit amet consectetuer adipiscing elit proin,3,2021-12-05
7185,sapien in sapien iaculis congue vivamus,4,2021-12-18
7186,eget orci vehicula condimentum curabitur in,4,2021-11-13
7187,et commodo vulputate justo in blandit,4,2022-10-18
7188,ipsum praesent blandit lacinia erat vestibulum,5,2022-08-04
7189,aliquam quis turpis eget elit,5,2022-04-23
7190,diam nam tristique tortor eu,5,2022-03-25
7191,eget nunc donec quis orci eget,1,2021-11-28
7192,sapien a libero nam dui,3,2022-04-25
7193,eget massa tempor convallis,5,2022-04-11
7194,sapien cum sociis natoque penatibus et,3,2022-09-12
7195,eget vulputate ut ultrices vel augue,5,2021-12-18
7196,pede justo lacinia eget,5,2021-12-05
7197,ac nulla sed vel enim sit,2,2022-02-02
7198,habitasse platea dictumst maecenas ut massa,5,2022-01-07
7199,morbi a ipsum integer a nibh,4,2022-07-30
7200,interdum in ante vestibulum ante ipsum,1,2021-11-16
7201,porttitor id consequat in,4,2022-04-24
7202,justo aliquam quis turpis,2,2021-12-15
7203,sed accumsan felis ut at,3,2022-04-15
7204,orci luctus et ultrices posuere,3,2021-11-17
7205,justo sit amet sapien,1,2021-11-03
7206,pede venenatis non sodales sed,1,2022-06-15
7207,primis in faucibus orci,5,2022-04-18
7208,in ante vestibulum ante ipsum primis,5,2022-02-27
7209,auctor gravida sem praesent id massa,3,2021-12-10
7210,tincidunt nulla mollis molestie lorem quisque,3,2021-11-14
7211,nunc proin at turpis a,1,2022-09-18
7212,ipsum dolor sit amet consectetuer adipiscing,3,2022-01-20
7213,etiam faucibus cursus urna ut tellus,2,2021-11-11
7214,convallis eget eleifend luctus ultricies,3,2022-03-25
7215,in faucibus orci luctus et ultrices,5,2022-03-22
7216,cum sociis natoque penatibus,1,2022-08-22
7217,tincidunt ante vel ipsum,4,2022-10-02
7218,a libero nam dui proin leo,5,2022-10-17
7219,dui vel sem sed sagittis,4,2022-08-24
7220,sed lacus morbi sem,1,2022-06-26
7221,pellentesque viverra pede ac diam,4,2022-01-31
7222,tincidunt lacus at velit,4,2021-12-03
7223,quis lectus suspendisse potenti in,3,2022-03-02
7224,proin interdum mauris non,1,2022-06-29
7225,nullam porttitor lacus at,4,2022-07-14
7226,dapibus nulla suscipit ligula in,3,2021-12-23
7227,in consequat ut nulla sed,4,2022-02-26
7228,ac nibh fusce lacus purus,4,2022-06-09
7229,lectus in est risus auctor,4,2022-07-18
7230,elit ac nulla sed,5,2021-12-29
7231,ligula vehicula consequat morbi a,5,2021-12-20
7232,tortor sollicitudin mi sit,1,2022-01-29
7233,vitae ipsum aliquam non,1,2021-11-14
7234,turpis integer aliquet massa id,4,2022-04-29
7235,erat eros viverra eget congue eget,3,2022-10-07
7236,potenti nullam porttitor lacus,2,2022-02-17
7237,commodo placerat praesent blandit nam,3,2022-10-10
7238,integer pede justo lacinia,1,2022-06-27
7239,eleifend pede libero quis orci,3,2022-08-06
7240,ut mauris eget massa,1,2022-10-20
7241,porttitor lacus at turpis,5,2022-08-29
7242,donec ut mauris eget massa,5,2022-04-22
7243,ante nulla justo aliquam quis,1,2022-04-01
7244,nec sem duis aliquam convallis,3,2022-10-30
7245,lobortis vel dapibus at diam,5,2021-12-14
7246,praesent lectus vestibulum quam sapien varius,3,2022-09-01
7247,nec dui luctus rutrum nulla,2,2021-12-14
7248,posuere metus vitae ipsum aliquam,3,2022-10-18
7249,lobortis vel dapibus at,1,2021-11-09
7250,at feugiat non pretium quis,5,2021-12-31
7251,potenti cras in purus eu magna,1,2022-02-03
7252,at vulputate vitae nisl aenean lectus,4,2021-11-15
7253,morbi odio odio elementum eu,4,2022-10-26
7254,nulla ut erat id,1,2022-01-24
7255,vestibulum ante ipsum primis in faucibus,1,2022-06-06
7256,eu felis fusce posuere felis sed,3,2022-10-13
7257,at nunc commodo placerat praesent blandit,3,2022-10-31
7258,dui luctus rutrum nulla,3,2022-05-13
7259,nulla sed vel enim sit,4,2022-05-06
7260,justo pellentesque viverra pede ac,2,2022-04-23
7261,nulla neque libero convallis eget,4,2022-08-20
7262,nullam orci pede venenatis non sodales,4,2022-01-30
7263,enim in tempor turpis nec euismod,5,2022-07-17
7264,diam erat fermentum justo,1,2021-12-03
7265,dapibus nulla suscipit ligula,2,2021-11-28
7266,et eros vestibulum ac est,4,2022-01-30
7267,feugiat et eros vestibulum ac est,4,2022-07-15
7268,at feugiat non pretium quis lectus,4,2021-11-17
7269,duis at velit eu est congue,2,2022-07-01
7270,nulla nunc purus phasellus in,4,2022-10-23
7271,maecenas pulvinar lobortis est,2,2022-08-11
7272,at nunc commodo placerat praesent blandit,1,2022-08-28
7273,duis aliquam convallis nunc,2,2021-11-14
7274,fusce consequat nulla nisl nunc,3,2022-06-06
7275,sapien non mi integer,1,2022-08-04
7276,in faucibus orci luctus et,3,2022-02-12
7277,aliquet at feugiat non pretium quis,4,2022-03-17
7278,tellus semper interdum mauris ullamcorper purus,4,2022-08-05
7279,odio porttitor id consequat,4,2021-12-09
7280,eu orci mauris lacinia,5,2022-04-09
7281,tempus semper est quam pharetra magna,2,2022-04-21
7282,nisi venenatis tristique fusce congue diam,1,2022-08-04
7283,dolor vel est donec odio justo,5,2022-05-09
7284,ligula sit amet eleifend pede,2,2022-01-28
7285,curae nulla dapibus dolor vel est,1,2022-03-19
7286,massa tempor convallis nulla neque,5,2022-04-20
7287,pellentesque ultrices mattis odio donec,4,2022-05-25
7288,dolor vel est donec odio,5,2022-10-08
7289,dapibus augue vel accumsan tellus nisi,5,2022-03-04
7290,sapien ut nunc vestibulum ante ipsum,3,2022-07-11
7291,felis donec semper sapien a libero,5,2022-08-31
7292,dolor sit amet consectetuer,4,2022-09-06
7293,in hac habitasse platea dictumst,5,2022-07-04
7294,ut dolor morbi vel lectus in,4,2021-12-27
7295,nibh in hac habitasse platea dictumst,4,2022-04-30
7296,eget eleifend luctus ultricies eu nibh,2,2022-01-19
7297,augue vestibulum rutrum rutrum,5,2022-02-21
7298,id lobortis convallis tortor risus dapibus,1,2022-07-10
7299,vestibulum sed magna at nunc commodo,3,2021-12-30
7300,suspendisse potenti nullam porttitor,3,2022-01-13
7301,ut massa volutpat convallis morbi odio,4,2021-12-09
7302,turpis integer aliquet massa id,2,2022-06-11
7303,vel sem sed sagittis,3,2022-05-20
7304,aenean auctor gravida sem,4,2022-08-11
7305,mattis nibh ligula nec sem,3,2022-10-10
7306,vestibulum sit amet cursus,3,2022-08-07
7307,lobortis vel dapibus at diam nam,1,2022-10-09
7308,congue elementum in hac habitasse,1,2021-11-02
7309,eu orci mauris lacinia sapien,1,2022-05-22
7310,non velit nec nisi vulputate nonummy,3,2021-11-10
7311,maecenas ut massa quis augue luctus,2,2022-01-12
7312,tristique in tempus sit amet,5,2022-08-24
7313,felis eu sapien cursus,1,2022-01-19
7314,et ultrices posuere cubilia curae duis,4,2021-11-18
7315,sit amet lobortis sapien sapien,3,2022-03-03
7316,odio elementum eu interdum,1,2022-03-11
7317,habitasse platea dictumst etiam faucibus,2,2022-02-22
7318,sed justo pellentesque viverra pede ac,4,2022-08-31
7319,sed justo pellentesque viverra pede,2,2022-03-05
7320,hac habitasse platea dictumst,4,2022-06-26
7321,sit amet consectetuer adipiscing elit proin,3,2022-03-20
7322,curae nulla dapibus dolor vel,2,2022-04-19
7323,nulla justo aliquam quis turpis,2,2022-08-10
7324,integer non velit donec diam,5,2021-11-13
7325,posuere cubilia curae duis faucibus accumsan,2,2022-09-08
7326,nisi nam ultrices libero,1,2022-07-21
7327,vel nulla eget eros,5,2022-02-11
7328,potenti cras in purus eu,4,2022-01-04
7329,velit nec nisi vulputate,5,2022-09-15
7330,leo maecenas pulvinar lobortis,2,2022-01-25
7331,a libero nam dui proin,3,2022-04-15
7332,amet nulla quisque arcu libero,2,2022-04-21
7333,sociis natoque penatibus et magnis dis,5,2022-03-28
7334,ullamcorper augue a suscipit nulla,2,2022-01-25
7335,aliquam sit amet diam,1,2022-09-21
7336,et tempus semper est,1,2022-09-18
7337,ipsum dolor sit amet consectetuer,4,2022-04-28
7338,eleifend quam a odio,3,2022-08-10
7339,lacus morbi sem mauris laoreet,4,2022-03-08
7340,habitasse platea dictumst morbi vestibulum,2,2022-03-26
7341,quisque porta volutpat erat,5,2022-01-05
7342,consectetuer adipiscing elit proin risus,5,2022-06-02
7343,lacinia nisi venenatis tristique fusce congue,4,2022-08-25
7344,consequat dui nec nisi,2,2022-04-07
7345,blandit lacinia erat vestibulum sed,1,2022-03-29
7346,viverra eget congue eget semper,1,2022-01-19
7347,porta volutpat erat quisque,1,2022-02-04
7348,tortor risus dapibus augue,1,2022-10-01
7349,praesent id massa id nisl venenatis,1,2022-08-15
7350,iaculis justo in hac habitasse platea,2,2022-01-30
7351,odio odio elementum eu,2,2022-04-15
7352,proin leo odio porttitor id,5,2022-06-28
7353,tempus sit amet sem fusce consequat,3,2022-03-28
7354,sed sagittis nam congue risus semper,5,2022-06-13
7355,tincidunt lacus at velit,5,2022-01-11
7356,rutrum nulla tellus in,4,2021-11-28
7357,aliquet ultrices erat tortor,3,2022-05-07
7358,lobortis vel dapibus at diam nam,5,2022-02-10
7359,sit amet cursus id turpis,4,2022-02-11
7360,fusce lacus purus aliquet at,3,2022-09-27
7361,massa tempor convallis nulla,4,2021-11-02
7362,vulputate luctus cum sociis,4,2022-05-14
7363,potenti cras in purus eu magna,3,2022-09-22
7364,orci pede venenatis non,4,2022-04-14
7365,nascetur ridiculus mus etiam,5,2022-03-07
7366,non mattis pulvinar nulla pede,4,2021-11-19
7367,vel ipsum praesent blandit,1,2022-08-13
7368,fusce posuere felis sed,3,2022-06-04
7369,turpis adipiscing lorem vitae mattis,2,2021-11-08
7370,eros vestibulum ac est,5,2022-07-13
7371,ante ipsum primis in,2,2022-05-09
7372,quis turpis sed ante,1,2021-12-14
7373,venenatis turpis enim blandit mi in,3,2022-01-26
7374,habitasse platea dictumst etiam faucibus cursus,1,2022-07-04
7375,vulputate elementum nullam varius nulla facilisi,5,2022-02-18
7376,ut odio cras mi pede,2,2022-01-17
7377,sit amet justo morbi,2,2022-03-26
7378,interdum venenatis turpis enim,1,2022-03-22
7379,sem duis aliquam convallis nunc,5,2021-12-31
7380,augue vestibulum rutrum rutrum neque,3,2022-01-27
7381,lorem id ligula suspendisse,5,2022-07-08
7382,nibh fusce lacus purus,2,2022-09-11
7383,nulla tellus in sagittis,4,2021-12-26
7384,justo sollicitudin ut suscipit,2,2022-03-07
7385,praesent blandit nam nulla integer,2,2022-06-21
7386,primis in faucibus orci,4,2022-08-12
7387,eleifend pede libero quis orci,3,2022-09-23
7388,sapien dignissim vestibulum vestibulum,3,2022-07-26
7389,aliquet ultrices erat tortor sollicitudin,5,2022-02-17
7390,sit amet justo morbi ut odio,3,2022-02-09
7391,amet lobortis sapien sapien,3,2022-10-25
7392,morbi non quam nec dui,4,2022-01-03
7393,nec nisi volutpat eleifend donec,3,2022-09-07
7394,morbi a ipsum integer a nibh,5,2022-04-07
7395,in faucibus orci luctus et,3,2022-05-27
7396,suscipit nulla elit ac nulla sed,1,2022-05-26
7397,ac tellus semper interdum mauris ullamcorper,4,2022-03-30
7398,vestibulum sed magna at nunc commodo,3,2022-04-17
7399,leo odio condimentum id,3,2022-07-26
7400,molestie nibh in lectus pellentesque at,5,2022-01-12
7401,quam nec dui luctus rutrum,5,2022-01-14
7402,vestibulum velit id pretium,4,2021-11-15
7403,erat tortor sollicitudin mi sit,1,2021-12-03
7404,natoque penatibus et magnis dis parturient,5,2022-04-27
7405,pede lobortis ligula sit amet eleifend,3,2022-08-13
7406,nibh quisque id justo,1,2022-01-29
7407,ligula nec sem duis,3,2022-09-18
7408,vestibulum velit id pretium iaculis,4,2022-06-12
7409,donec ut dolor morbi,3,2022-02-19
7410,cursus vestibulum proin eu,4,2022-08-26
7411,montes nascetur ridiculus mus etiam,5,2022-08-22
7412,lorem ipsum dolor sit,5,2022-01-03
7413,diam nam tristique tortor eu pede,2,2022-10-19
7414,nunc purus phasellus in,5,2022-07-17
7415,eleifend quam a odio,5,2022-07-29
7416,erat volutpat in congue etiam justo,4,2022-08-04
7417,nunc commodo placerat praesent blandit nam,4,2021-11-16
7418,feugiat et eros vestibulum,4,2022-10-27
7419,ut dolor morbi vel lectus,1,2022-03-27
7420,erat id mauris vulputate elementum nullam,2,2022-04-16
7421,diam cras pellentesque volutpat,5,2022-02-06
7422,orci pede venenatis non sodales sed,1,2022-07-22
7423,quis libero nullam sit,4,2022-09-28
7424,tristique tortor eu pede,2,2021-11-18
7425,in faucibus orci luctus et ultrices,1,2022-07-14
7426,interdum mauris non ligula,3,2021-11-06
7427,erat volutpat in congue etiam justo,5,2022-05-30
7428,et ultrices posuere cubilia curae duis,4,2021-11-15
7429,mattis pulvinar nulla pede ullamcorper augue,3,2022-03-16
7430,magna vulputate luctus cum sociis,5,2022-08-06
7431,lectus pellentesque eget nunc donec,3,2022-01-26
7432,posuere felis sed lacus morbi sem,1,2021-12-03
7433,justo aliquam quis turpis eget,4,2022-04-13
7434,nisl duis ac nibh fusce lacus,4,2022-03-28
7435,magna vestibulum aliquet ultrices,3,2022-05-01
7436,vulputate vitae nisl aenean lectus,2,2022-06-11
7437,justo in hac habitasse platea dictumst,1,2022-06-17
7438,in libero ut massa,3,2022-06-06
7439,in faucibus orci luctus et,4,2022-10-13
7440,massa id lobortis convallis tortor risus,3,2022-02-07
7441,rhoncus dui vel sem sed sagittis,5,2022-06-08
7442,erat fermentum justo nec,5,2022-01-15
7443,in ante vestibulum ante,5,2022-06-17
7444,amet diam in magna,3,2021-12-30
7445,lobortis convallis tortor risus dapibus,1,2022-03-14
7446,pulvinar nulla pede ullamcorper,1,2022-02-12
7447,ornare imperdiet sapien urna,2,2021-11-16
7448,magnis dis parturient montes nascetur,2,2022-04-23
7449,sed magna at nunc commodo,4,2021-11-23
7450,ut volutpat sapien arcu sed augue,1,2022-10-14
7451,dui vel nisl duis ac nibh,5,2022-02-10
7452,morbi a ipsum integer,5,2022-05-22
7453,sed sagittis nam congue,5,2022-06-18
7454,ut suscipit a feugiat et eros,4,2022-08-29
7455,at dolor quis odio consequat varius,4,2022-08-08
7456,interdum mauris ullamcorper purus,1,2022-05-29
7457,fringilla rhoncus mauris enim leo,5,2022-02-12
7458,eu felis fusce posuere felis,3,2022-05-09
7459,mattis nibh ligula nec,4,2021-12-11
7460,duis bibendum felis sed interdum venenatis,3,2022-08-20
7461,vitae nisl aenean lectus pellentesque eget,1,2022-09-10
7462,nonummy maecenas tincidunt lacus at,4,2022-04-21
7463,donec ut mauris eget massa tempor,5,2022-04-07
7464,luctus et ultrices posuere cubilia curae,5,2021-12-24
7465,a libero nam dui,3,2021-11-27
7466,curae donec pharetra magna,3,2022-10-05
7467,vitae nisi nam ultrices,1,2022-10-14
7468,vel nulla eget eros elementum pellentesque,4,2022-05-21
7469,dolor sit amet consectetuer adipiscing elit,3,2022-08-30
7470,quis justo maecenas rhoncus aliquam,1,2022-08-09
7471,quisque ut erat curabitur,2,2022-08-07
7472,dui luctus rutrum nulla,1,2022-10-16
7473,purus phasellus in felis donec,5,2022-02-08
7474,justo sollicitudin ut suscipit a,4,2022-08-17
7475,in lacus curabitur at,4,2022-08-13
