4893,rutrum neque aenean auctor gravida sem,2,2022-03-14
4894,proin risus praesent lectus vestibulum,2,2021-12-08
4895,faucibus orci luctus et ultrices,5,2022-01-10
4896,aenean sit amet justo morbi ut,7,2022-05-10
4897,aliquet ultrices erat tortor sollicitudin mi,4,2021-11-23
4898,sodales scelerisque mauris sit amet,7,2021-11-18
4899,dolor vel est donec odio,6,2022-05-03
4900,enim blandit mi in porttitor,7,2022-05-03
4901,nascetur ridiculus mus vivamus vestibulum,2,2022-06-12
4902,eros suspendisse accumsan tortor quis,4,2022-06-16
4903,aliquet ultrices erat tortor sollicitudin,6,2022-04-19
4904,eget eros elementum pellentesque quisque porta,2,2021-11-26
4905,sit amet erat nulla tempus,6,2022-05-31
4906,viverra diam vitae quam suspendisse potenti,6,2022-05-15
4907,metus arcu adipiscing molestie hendrerit,7,2022-03-13
4908,sollicitudin ut suscipit a feugiat et,7,2022-10-11
4909,nulla ac enim in tempor turpis,4,2022-03-14
4910,lobortis sapien sapien non mi,3,2021-11-15
4911,amet erat nulla tempus vivamus,1,2022-08-11
4912,at velit eu est congue,1,2022-08-07
4913,tempor convallis nulla neque libero,3,2022-03-15
4914,interdum venenatis turpis enim blandit,1,2022-08-14
4915,diam nam tristique tortor eu,5,2022-06-17
4916,pede ullamcorper augue a suscipit,3,2022-02-15
4917,ante vestibulum ante ipsum primis in,1,2022-07-23
4918,congue risus semper porta volutpat,1,2022-08-28
4919,pretium iaculis diam erat fermentum justo,4,2021-12-17
4920,a libero nam dui proin leo,4,2021-12-16
4921,gravida sem praesent id massa id,2,2021-11-22
4922,quam fringilla rhoncus mauris enim leo,7,2022-10-09
4923,ornare consequat lectus in est risus,6,2022-10-10
4924,pulvinar sed nisl nunc rhoncus dui,5,2021-11-22
4925,vestibulum sed magna at nunc commodo,1,2022-09-21
4926,congue eget semper rutrum nulla,7,2022-07-22
4927,in tempor turpis nec euismod scelerisque,6,2022-09-02
4928,neque aenean auctor gravida sem,5,2021-11-25
4929,odio consequat varius integer ac leo,6,2022-02-24
4930,posuere cubilia curae nulla dapibus dolor,2,2022-08-30
4931,ut blandit non interdum in,7,2022-09-22
4932,imperdiet nullam orci pede venenatis non,5,2022-09-22
4933,ac est lacinia nisi venenatis,2,2022-08-09
4934,at velit eu est congue,5,2022-01-30
4935,magna vestibulum aliquet ultrices erat,1,2022-05-25
4936,convallis nunc proin at turpis,6,2022-03-26
4937,tortor id nulla ultrices aliquet maecenas,3,2022-07-27
4938,nec euismod scelerisque quam turpis adipiscing,4,2022-06-13
4939,maecenas rhoncus aliquam lacus morbi,6,2021-11-12
4940,penatibus et magnis dis parturient montes,7,2021-12-30
4941,at ipsum ac tellus semper interdum,3,2022-06-06
4942,in consequat ut nulla sed accumsan,7,2022-04-15
4943,luctus nec molestie sed justo,6,2021-12-23
4944,nulla dapibus dolor vel est donec,1,2022-10-20
4945,ultrices phasellus id sapien in sapien,2,2022-01-01
4946,consequat morbi a ipsum integer a,4,2021-12-02
4947,odio odio elementum eu interdum eu,2,2021-11-16
4948,non velit donec diam neque vestibulum,2,2022-01-08
4949,lacinia aenean sit amet justo,3,2022-04-13
4950,enim lorem ipsum dolor sit amet,4,2022-06-06
4951,pulvinar nulla pede ullamcorper augue,1,2022-07-11
4952,condimentum id luctus nec molestie,6,2021-12-13
4953,eleifend luctus ultricies eu nibh,5,2022-05-13
4954,fermentum donec ut mauris eget massa,6,2022-10-05
4955,consequat morbi a ipsum integer a,3,2022-04-19
4956,augue luctus tincidunt nulla mollis,4,2021-11-24
4957,luctus et ultrices posuere cubilia,3,2021-11-13
4958,scelerisque quam turpis adipiscing lorem,6,2022-05-12
4959,sollicitudin vitae consectetuer eget rutrum,6,2022-06-29
4960,sapien varius ut blandit non interdum,4,2022-01-01
4961,nulla integer pede justo lacinia eget,2,2022-10-28
4962,vel accumsan tellus nisi eu orci,2,2021-11-02
4963,ornare imperdiet sapien urna pretium,4,2022-09-05
4964,felis eu sapien cursus vestibulum,4,2022-04-22
4965,justo in blandit ultrices enim,7,2022-06-18
4966,ridiculus mus vivamus vestibulum sagittis,7,2022-08-15
4967,lacus at turpis donec posuere,1,2021-11-26
4968,semper porta volutpat quam pede,3,2022-06-22
4969,rutrum nulla nunc purus phasellus in,3,2022-02-20
4970,nulla sed vel enim sit,1,2022-02-14
4971,quisque ut erat curabitur gravida nisi,6,2022-05-19
4972,rhoncus mauris enim leo rhoncus,7,2022-05-11
4973,amet erat nulla tempus vivamus in,2,2022-02-15
4974,sem praesent id massa id,7,2021-12-07
4975,vel augue vestibulum ante ipsum primis,1,2022-04-19
4976,orci mauris lacinia sapien quis,7,2022-10-01
4977,justo in hac habitasse platea,4,2021-12-28
4978,iaculis diam erat fermentum justo nec,3,2022-05-22
4979,arcu libero rutrum ac lobortis,7,2022-05-26
4980,nisl duis ac nibh fusce,7,2021-11-17
4981,vel est donec odio justo,1,2021-12-02
4982,lectus vestibulum quam sapien varius,4,2022-10-20
4983,nullam porttitor lacus at turpis donec,2,2021-12-11
4984,pede venenatis non sodales sed tincidunt,3,2022-06-28
4985,platea dictumst maecenas ut massa quis,4,2022-02-12
4986,risus auctor sed tristique in,2,2022-06-19
4987,amet sem fusce consequat nulla nisl,1,2021-11-22
4988,pede venenatis non sodales sed tincidunt,2,2022-05-15
4989,dolor sit amet consectetuer adipiscing,1,2022-02-01
4990,elit proin interdum mauris non,7,2021-11-03
4991,habitasse platea dictumst maecenas ut,3,2022-03-16
4992,at velit eu est congue,4,2022-04-09
4993,lacinia sapien quis libero nullam,2,2021-12-01
4994,rhoncus sed vestibulum sit amet,1,2022-03-09
4995,pede lobortis ligula sit amet eleifend,3,2022-03-30
4996,scelerisque mauris sit amet eros,4,2021-12-23
4997,nec dui luctus rutrum nulla tellus,4,2022-09-11
4998,sagittis sapien cum sociis natoque,7,2021-11-03
4999,luctus et ultrices posuere cubilia,1,2022-05-09
5000,consequat nulla nisl nunc nisl,5,2022-06-26
5001,sem duis aliquam convallis nunc,3,2022-09-18
5002,sapien non mi integer,4,2022-09-09
5003,et ultrices posuere cubilia curae nulla,2,2022-10-31
5004,pede malesuada in imperdiet,5,2022-04-19
5005,parturient montes nascetur ridiculus mus,5,2022-05-24
5006,ante nulla justo aliquam quis,1,2021-12-25
5007,mauris eget massa tempor convallis nulla,4,2022-01-21
5008,mattis egestas metus aenean,1,2021-11-13
5009,at turpis donec posuere,5,2022-08-22
5010,non pretium quis lectus suspendisse potenti,4,2022-06-16
5011,ut nunc vestibulum ante ipsum primis,1,2021-12-25
5012,tincidunt nulla mollis molestie,5,2022-01-24
5013,rutrum nulla tellus in,5,2022-05-28
5014,augue aliquam erat volutpat in,2,2022-06-01
5015,gravida nisi at nibh in,4,2022-04-03
5016,vestibulum sed magna at nunc commodo,1,2022-01-27
5017,ipsum primis in faucibus orci luctus,5,2022-05-26
5018,justo maecenas rhoncus aliquam lacus morbi,2,2022-10-27
5019,eros suspendisse accumsan tortor quis turpis,1,2022-10-01
5020,id mauris vulputate elementum nullam,3,2021-12-28
5021,lacus purus aliquet at feugiat,3,2022-05-21
5022,nam congue risus semper porta volutpat,5,2022-01-01
5023,neque aenean auctor gravida sem,4,2022-05-05
5024,mus vivamus vestibulum sagittis,2,2022-09-30
5025,lectus in est risus,2,2022-04-28
5026,elementum nullam varius nulla,1,2022-02-01
5027,nisl aenean lectus pellentesque eget,2,2022-08-04
5028,convallis nulla neque libero convallis,4,2022-09-17
5029,volutpat eleifend donec ut dolor,3,2021-12-12
5030,nisi venenatis tristique fusce congue,4,2022-04-05
5031,convallis tortor risus dapibus augue,3,2022-10-22
5032,sapien placerat ante nulla justo aliquam,3,2022-07-25
5033,lobortis est phasellus sit,2,2022-06-24
5034,ligula pellentesque ultrices phasellus id sapien,4,2021-11-13
5035,nulla nunc purus phasellus in felis,3,2022-09-09
5036,curabitur in libero ut massa volutpat,1,2022-07-11
5037,augue quam sollicitudin vitae,2,2022-07-26
5038,praesent lectus vestibulum quam sapien,4,2022-08-28
5039,aliquet pulvinar sed nisl nunc,3,2022-10-13
5040,at velit eu est,4,2022-07-09
5041,duis faucibus accumsan odio curabitur convallis,1,2022-01-22
5042,ligula pellentesque ultrices phasellus id,3,2022-03-19
5043,lectus vestibulum quam sapien varius,2,2022-04-17
5044,turpis nec euismod scelerisque,4,2022-08-26
5045,at feugiat non pretium quis,3,2022-10-17
5046,in purus eu magna,3,2022-05-25
5047,pretium iaculis justo in hac habitasse,5,2022-03-28
5048,lobortis convallis tortor risus,5,2022-08-26
5049,id lobortis convallis tortor risus,3,2022-07-19
5050,morbi quis tortor id nulla ultrices,3,2022-03-23
5051,volutpat quam pede lobortis,4,2021-12-05
5052,nam ultrices libero non mattis pulvinar,1,2021-12-19
5053,interdum in ante vestibulum ante,2,2022-03-13
5054,ac tellus semper interdum mauris,2,2022-01-11
5055,at turpis donec posuere metus vitae,1,2021-11-25
5056,cubilia curae donec pharetra magna vestibulum,2,2022-08-14
5057,bibendum imperdiet nullam orci,3,2021-12-17
5058,nunc donec quis orci eget orci,3,2022-09-05
5059,orci luctus et ultrices posuere cubilia,3,2021-12-02
5060,ligula suspendisse ornare consequat lectus,2,2022-01-07
5061,quisque id justo sit amet sapien,5,2021-12-23
5062,in ante vestibulum ante ipsum primis,1,2022-05-31
5063,id ornare imperdiet sapien urna,5,2022-06-24
5064,hac habitasse platea dictumst,4,2022-02-01
5065,duis bibendum felis sed,1,2022-08-28
5066,dui maecenas tristique est et,2,2021-12-02
5067,iaculis congue vivamus metus arcu adipiscing,5,2022-08-13
5068,nisi at nibh in hac habitasse,3,2022-02-25
5069,pretium quis lectus suspendisse,1,2022-07-13
5070,rhoncus aliquet pulvinar sed nisl nunc,5,2021-11-18
5071,molestie nibh in lectus,1,2022-07-13
5072,odio odio elementum eu interdum,5,2022-03-09
5073,dictumst morbi vestibulum velit,5,2022-01-03
5074,donec odio justo sollicitudin ut suscipit,2,2022-08-03
5075,in est risus auctor sed tristique,5,2022-01-31
5076,duis aliquam convallis nunc proin at,4,2022-02-24
5077,tincidunt in leo maecenas pulvinar,3,2022-02-08
5078,quam sollicitudin vitae consectetuer eget,4,2022-04-06
5079,quisque id justo sit amet sapien,1,2022-02-19
5080,lacinia erat vestibulum sed,1,2022-09-21
5081,odio odio elementum eu interdum eu,2,2022-02-27
5082,cubilia curae donec pharetra magna vestibulum,3,2022-10-07
5083,potenti nullam porttitor lacus at,2,2021-11-12
5084,justo etiam pretium iaculis justo,1,2022-03-04
5085,tortor quis turpis sed ante,2,2022-09-02
5086,nulla eget eros elementum pellentesque,2,2021-12-21
5087,odio odio elementum eu interdum eu,5,2021-11-06
5088,non ligula pellentesque ultrices phasellus,2,2022-07-27
5089,lectus aliquam sit amet diam in,3,2022-03-20
5090,donec ut dolor morbi,1,2022-02-13
5091,eu magna vulputate luctus,2,2022-09-07
5092,dolor quis odio consequat varius,3,2022-09-12
5093,potenti nullam porttitor lacus at,3,2022-05-26
5094,id sapien in sapien iaculis,3,2022-01-21
5095,mattis nibh ligula nec sem duis,3,2022-04-23
5096,luctus rutrum nulla tellus,4,2022-04-16
5097,in est risus auctor,3,2022-04-05
5098,sapien arcu sed augue aliquam erat,2,2022-10-16
5099,ut massa volutpat convallis morbi,4,2022-07-09
5100,ut massa quis augue luctus tincidunt,1,2022-04-07
5101,est donec odio justo sollicitudin,1,2022-09-23
5102,elementum nullam varius nulla facilisi,1,2022-07-08
5103,maecenas rhoncus aliquam lacus morbi quis,4,2022-06-21
5104,proin eu mi nulla ac,3,2022-03-21
5105,in hac habitasse platea dictumst morbi,3,2022-01-23
5106,neque duis bibendum morbi non,1,2022-07-08
5107,congue eget semper rutrum,4,2022-10-08
5108,in blandit ultrices enim lorem ipsum,5,2022-07-17
5109,ligula in lacus curabitur,1,2022-02-27
5110,viverra diam vitae quam,3,2022-08-13
5111,massa volutpat convallis morbi odio,2,2022-07-10
5112,mi in porttitor pede,5,2022-10-29
5113,orci luctus et ultrices posuere,1,2022-08-06
5114,luctus nec molestie sed justo,3,2022-05-01
5115,integer aliquet massa id,4,2022-10-20
5116,risus praesent lectus vestibulum,4,2022-03-31
5117,maecenas ut massa quis augue luctus,1,2022-10-14
5118,etiam justo etiam pretium,2,2022-04-15
5119,rutrum nulla tellus in sagittis dui,5,2021-12-07
5120,cursus id turpis integer aliquet,3,2022-05-23
5121,amet diam in magna bibendum,4,2022-10-03
5122,luctus tincidunt nulla mollis,5,2021-11-09
5123,lobortis convallis tortor risus,4,2022-07-20
5124,ultrices posuere cubilia curae mauris,1,2022-10-01
5125,condimentum neque sapien placerat ante,1,2022-04-07
5126,id massa id nisl venenatis,2,2022-09-01
5127,lectus in quam fringilla,5,2022-04-16
5128,quisque ut erat curabitur,3,2022-06-09
5129,nulla justo aliquam quis turpis,5,2022-02-26
5130,quisque id justo sit amet sapien,4,2022-03-13
5131,in quis justo maecenas rhoncus aliquam,2,2022-03-28
5132,magna vestibulum aliquet ultrices erat tortor,2,2022-10-15
5133,dis parturient montes nascetur ridiculus mus,2,2022-07-06
5134,donec ut dolor morbi vel lectus,2,2022-06-17
5135,eros viverra eget congue eget semper,3,2022-01-09
5136,eget vulputate ut ultrices vel,3,2022-10-07
5137,quis lectus suspendisse potenti in eleifend,5,2022-02-04
5138,elementum ligula vehicula consequat morbi a,3,2022-10-11
5139,quis libero nullam sit amet turpis,3,2022-02-20
5140,suspendisse potenti in eleifend,3,2022-04-01
5141,tincidunt eget tempus vel pede morbi,1,2022-03-27
5142,nam dui proin leo odio,1,2021-11-30
5143,sed interdum venenatis turpis,3,2022-02-05
5144,libero nam dui proin,4,2022-07-03
5145,nisi eu orci mauris lacinia,5,2021-12-19
5146,tortor risus dapibus augue vel,3,2022-07-18
5147,convallis morbi odio odio elementum eu,3,2022-05-24
5148,risus dapibus augue vel,4,2021-12-10
5149,lectus in quam fringilla,5,2022-06-06
5150,orci eget orci vehicula condimentum,1,2022-03-08
5151,scelerisque quam turpis adipiscing lorem vitae,5,2022-03-19
5152,sit amet cursus id turpis,3,2021-11-19
5153,lacinia nisi venenatis tristique fusce congue,3,2021-11-24
5154,varius integer ac leo,2,2022-01-06
5155,mattis egestas metus aenean fermentum donec,1,2022-03-08
5156,proin eu mi nulla,2,2022-07-03
5157,nulla ut erat id,2,2022-05-17
5158,sapien urna pretium nisl ut,3,2022-01-24
5159,vitae mattis nibh ligula nec,5,2021-11-05
5160,vel enim sit amet,2,2022-04-26
5161,ornare consequat lectus in est,2,2022-07-21
5162,erat vestibulum sed magna at nunc,3,2022-09-01
5163,sed lacus morbi sem,2,2022-09-14
5164,diam neque vestibulum eget vulputate ut,5,2021-11-12
5165,ac leo pellentesque ultrices mattis,1,2022-03-10
5166,vestibulum ante ipsum primis,2,2021-12-20
5167,amet nulla quisque arcu libero,5,2022-06-14
5168,massa id lobortis convallis,2,2022-07-28
5169,pulvinar lobortis est phasellus sit amet,2,2022-03-11
5170,integer aliquet massa id lobortis convallis,1,2022-09-14
5171,nunc proin at turpis a pede,5,2021-12-31
5172,mauris laoreet ut rhoncus aliquet,4,2021-11-15
5173,vitae ipsum aliquam non mauris morbi,1,2022-08-26
5174,vestibulum ante ipsum primis in,5,2022-03-17
5175,non quam nec dui,2,2022-10-17
5176,quis turpis eget elit sodales,1,2022-04-29
5177,adipiscing lorem vitae mattis,2,2022-10-05
5178,mollis molestie lorem quisque ut,1,2022-04-10
5179,ultrices vel augue vestibulum,1,2022-10-12
5180,nibh quisque id justo,5,2022-06-28
5181,rutrum at lorem integer tincidunt ante,4,2021-11-27
5182,ligula suspendisse ornare consequat,5,2022-07-01
5183,vel ipsum praesent blandit lacinia,1,2022-07-06
5184,libero quis orci nullam molestie,1,2022-08-05
5185,vitae mattis nibh ligula nec sem,5,2021-11-10
5186,aenean auctor gravida sem praesent id,3,2022-03-02
5187,urna pretium nisl ut,3,2021-12-20
5188,curae duis faucibus accumsan odio,5,2021-12-24
5189,ut dolor morbi vel lectus in,1,2022-01-06
5190,sed nisl nunc rhoncus,5,2021-11-08
5191,quis turpis sed ante vivamus,3,2021-12-28
5192,elementum pellentesque quisque porta volutpat erat,4,2022-03-21
5193,vitae mattis nibh ligula,2,2022-07-09
5194,tincidunt nulla mollis molestie,4,2021-11-06
5195,in imperdiet et commodo vulputate justo,2,2022-10-20
5196,id justo sit amet sapien,4,2022-09-30
5197,integer aliquet massa id,1,2022-09-06
5198,in blandit ultrices enim lorem,2,2022-11-01
5199,parturient montes nascetur ridiculus mus,5,2022-02-17
5200,lacinia sapien quis libero,1,2022-06-02
5201,id sapien in sapien,5,2021-12-09
5202,pede ullamcorper augue a suscipit nulla,2,2022-04-02
5203,lorem vitae mattis nibh ligula nec,1,2022-09-20
5204,justo sollicitudin ut suscipit a feugiat,1,2021-12-17
5205,odio in hac habitasse platea,1,2021-12-25
5206,amet nulla quisque arcu libero,1,2022-06-09
5207,et ultrices posuere cubilia curae duis,1,2022-06-02
5208,habitasse platea dictumst maecenas,5,2022-09-22
5209,morbi sem mauris laoreet,4,2022-09-19
5210,volutpat convallis morbi odio odio elementum,2,2022-01-07
5211,magnis dis parturient montes nascetur ridiculus,1,2022-05-22
5212,sed vestibulum sit amet cursus id,2,2021-12-06
5213,luctus cum sociis natoque penatibus,4,2022-11-01
5214,iaculis diam erat fermentum justo nec,4,2022-04-17
5215,eget rutrum at lorem,1,2022-01-29
5216,scelerisque mauris sit amet,1,2022-05-11
5217,vel lectus in quam fringilla,5,2022-03-29
5218,lectus in quam fringilla rhoncus,3,2022-07-19
5219,euismod scelerisque quam turpis adipiscing lorem,3,2022-04-09
5220,vel enim sit amet,5,2022-10-21
5221,iaculis diam erat fermentum justo nec,4,2022-01-01
5222,sit amet justo morbi ut,4,2022-03-31
5223,at dolor quis odio consequat,2,2022-02-20
5224,aliquam lacus morbi quis tortor,4,2022-01-27
5225,justo morbi ut odio cras mi,1,2022-05-19
5226,sapien placerat ante nulla,5,2022-04-09
5227,ipsum aliquam non mauris,3,2022-04-05
5228,mattis pulvinar nulla pede ullamcorper augue,1,2022-05-22
5229,ultrices aliquet maecenas leo,1,2022-06-27
5230,augue vestibulum ante ipsum,2,2021-11-19
5231,vel enim sit amet,1,2022-06-01
5232,sit amet diam in magna,3,2022-01-19
5233,non mattis pulvinar nulla pede,4,2022-04-11
5234,curae mauris viverra diam,1,2022-06-04
5235,ut mauris eget massa,2,2021-12-08
5236,massa donec dapibus duis at,2,2021-12-27
5237,ante ipsum primis in faucibus orci,4,2022-09-18
5238,quam nec dui luctus,5,2022-06-29
5239,diam cras pellentesque volutpat,4,2022-06-17
5240,natoque penatibus et magnis dis parturient,1,2022-06-25
5241,quam sollicitudin vitae consectetuer eget rutrum,4,2022-07-16
5242,enim sit amet nunc viverra dapibus,2,2022-10-04
5243,sed vestibulum sit amet cursus id,4,2021-11-23
5244,eu mi nulla ac enim,2,2022-08-31
5245,vivamus metus arcu adipiscing molestie,4,2022-07-20
5246,nisi nam ultrices libero,1,2021-12-08
5247,curabitur convallis duis consequat,2,2022-01-18
5248,mattis odio donec vitae nisi nam,3,2021-11-05
5249,at nunc commodo placerat praesent blandit,5,2022-09-10
5250,turpis a pede posuere nonummy integer,4,2022-07-11
5251,tempor turpis nec euismod scelerisque quam,5,2022-10-21
5252,sit amet nulla quisque arcu,5,2021-12-14
5253,phasellus in felis donec,1,2022-06-19
5254,erat volutpat in congue etiam,2,2022-07-28
5255,tortor duis mattis egestas metus,5,2022-01-08
5256,sollicitudin vitae consectetuer eget,2,2021-11-16
5257,id luctus nec molestie sed justo,5,2022-01-23
5258,donec posuere metus vitae ipsum,1,2022-08-01
5259,in lacus curabitur at ipsum,4,2021-11-25
5260,penatibus et magnis dis parturient montes,4,2022-06-20
5261,est congue elementum in,2,2022-09-05
5262,ligula nec sem duis aliquam,2,2022-02-22
5263,amet consectetuer adipiscing elit proin interdum,5,2022-03-19
5264,nisl ut volutpat sapien arcu sed,3,2022-06-16
5265,lorem quisque ut erat,5,2022-07-01
5266,metus aenean fermentum donec ut,5,2022-01-13
5267,in felis donec semper,1,2022-09-03
5268,lacus purus aliquet at feugiat non,3,2021-12-22
5269,etiam pretium iaculis justo in,4,2021-12-10
5270,a ipsum integer a,4,2022-04-17
5271,sodales sed tincidunt eu felis fusce,1,2021-12-06
5272,velit id pretium iaculis diam erat,3,2022-07-25
5273,at feugiat non pretium quis,5,2022-09-29
5274,posuere metus vitae ipsum aliquam,1,2022-04-01
5275,erat fermentum justo nec condimentum neque,2,2022-06-27
5276,suspendisse potenti in eleifend quam,5,2022-06-06
5277,imperdiet nullam orci pede venenatis non,1,2022-04-06
5278,ac est lacinia nisi venenatis,4,2022-08-06
5279,fermentum justo nec condimentum neque sapien,2,2022-08-09
5280,habitasse platea dictumst etiam,1,2022-01-13
5281,duis bibendum morbi non quam,5,2022-05-04
5282,pede ullamcorper augue a suscipit,4,2022-04-28
5283,ac consequat metus sapien ut,2,2022-03-31
5284,mi nulla ac enim in tempor,4,2022-08-24
5285,blandit mi in porttitor pede,3,2022-10-21
5286,convallis morbi odio odio,2,2021-12-22
5287,eget nunc donec quis orci,3,2022-10-11
5288,duis bibendum felis sed interdum,3,2022-02-03
5289,ultrices posuere cubilia curae,5,2022-08-19
5290,odio consequat varius integer ac,3,2022-06-23
5291,morbi non lectus aliquam,5,2021-11-13
5292,quam pharetra magna ac consequat metus,3,2022-01-11
5293,blandit nam nulla integer,4,2022-01-09
5294,nulla sed vel enim,2,2022-01-16
5295,donec dapibus duis at velit eu,5,2021-12-20
5296,ridiculus mus vivamus vestibulum sagittis sapien,5,2022-10-16
5297,molestie nibh in lectus pellentesque,2,2021-12-30
5298,praesent lectus vestibulum quam sapien,4,2022-05-19
5299,nam nulla integer pede justo lacinia,5,2022-07-04
5300,suspendisse potenti nullam porttitor,3,2022-03-23
5301,lobortis sapien sapien non mi integer,1,2022-05-31
5302,dui luctus rutrum nulla tellus,4,2022-07-21
5303,viverra dapibus nulla suscipit ligula,4,2022-07-28
5304,id sapien in sapien iaculis,4,2022-09-27
5305,duis bibendum felis sed interdum venenatis,5,2022-04-24
5306,nec molestie sed justo pellentesque viverra,5,2022-09-04
5307,et ultrices posuere cubilia curae,4,2022-01-11
5308,turpis donec posuere metus vitae ipsum,4,2022-04-01
5309,ultrices posuere cubilia curae donec,4,2022-07-08
5310,leo maecenas pulvinar lobortis est,1,2022-02-08
5311,ac tellus semper interdum mauris,4,2022-09-14
5312,sagittis dui vel nisl,4,2022-02-21
5313,ut volutpat sapien arcu sed,4,2021-11-20
5314,massa id nisl venenatis lacinia,1,2022-05-30
5315,malesuada in imperdiet et commodo vulputate,5,2022-01-20
5316,nulla dapibus dolor vel est donec,4,2022-04-18
5317,vel sem sed sagittis,1,2022-01-17
5318,eleifend quam a odio,1,2021-12-01
5319,aenean lectus pellentesque eget nunc donec,1,2022-05-21
5320,turpis eget elit sodales scelerisque,2,2022-10-18
5321,massa volutpat convallis morbi odio odio,4,2022-06-03
5322,mollis molestie lorem quisque,1,2021-12-19
5323,ligula sit amet eleifend pede,2,2022-06-06
5324,lectus aliquam sit amet diam in,4,2022-10-05
5325,venenatis non sodales sed tincidunt eu,1,2022-07-11
5326,eget eleifend luctus ultricies eu nibh,2,2022-08-06
5327,vulputate nonummy maecenas tincidunt lacus at,2,2022-02-17
5328,dui luctus rutrum nulla,5,2022-04-02
5329,est congue elementum in hac habitasse,5,2022-07-26
5330,dui proin leo odio porttitor id,3,2022-05-04
5331,turpis nec euismod scelerisque quam,4,2022-06-14
5332,non ligula pellentesque ultrices phasellus id,1,2022-10-14
5333,tempus vivamus in felis eu sapien,3,2022-04-14
5334,mauris enim leo rhoncus sed vestibulum,2,2022-03-25
5335,dolor sit amet consectetuer adipiscing elit,3,2022-09-18
5336,ridiculus mus etiam vel augue vestibulum,5,2022-05-30
5337,neque duis bibendum morbi non quam,5,2022-01-10
5338,suscipit ligula in lacus curabitur,1,2022-07-19
5339,quis orci nullam molestie,1,2022-06-05
5340,imperdiet sapien urna pretium nisl,4,2022-07-31
5341,lobortis vel dapibus at,5,2022-10-29
5342,adipiscing lorem vitae mattis nibh ligula,4,2022-04-29
5343,placerat praesent blandit nam,2,2022-06-22
5344,tempus vel pede morbi porttitor lorem,2,2022-08-21
5345,morbi non quam nec dui,4,2022-08-14
5346,platea dictumst maecenas ut massa,3,2022-04-29
5347,ipsum primis in faucibus orci,4,2022-01-07
5348,eget congue eget semper,1,2022-09-24
5349,etiam pretium iaculis justo in,3,2021-12-26
5350,turpis integer aliquet massa,1,2022-07-01
5351,venenatis non sodales sed,4,2022-06-29
5352,lobortis vel dapibus at diam,2,2022-05-27
5353,nisi at nibh in hac,3,2022-03-05
5354,eget tempus vel pede morbi,1,2022-05-01
5355,leo odio condimentum id,2,2021-12-02
5356,orci pede venenatis non,1,2022-10-25
5357,sed accumsan felis ut at,2,2022-04-29
5358,vestibulum velit id pretium iaculis diam,2,2021-11-30
5359,luctus tincidunt nulla mollis,1,2021-11-18
5360,sed sagittis nam congue,5,2022-02-24
5361,cum sociis natoque penatibus et,5,2022-03-10
5362,at vulputate vitae nisl aenean lectus,5,2022-07-07
5363,facilisi cras non velit,5,2022-07-03
5364,aliquam augue quam sollicitudin vitae,1,2021-11-28
5365,feugiat et eros vestibulum,1,2021-11-20
5366,lacus curabitur at ipsum,1,2021-11-05
5367,nisl duis bibendum felis,5,2022-08-30
5368,in faucibus orci luctus et ultrices,2,2022-03-20
5369,ac tellus semper interdum mauris,2,2022-02-11
5370,lacinia eget tincidunt eget tempus,4,2022-01-14
5371,enim in tempor turpis nec,4,2022-03-08
5372,et commodo vulputate justo,5,2022-02-16
5373,proin at turpis a,4,2021-11-11
5374,in lacus curabitur at,2,2022-04-11
5375,blandit nam nulla integer pede,4,2021-11-30
5376,quisque porta volutpat erat quisque erat,1,2022-08-23
5377,magnis dis parturient montes nascetur,3,2021-11-23
5378,sagittis dui vel nisl,2,2022-10-30
5380,consequat lectus in est risus,3,2022-04-10
5381,etiam pretium iaculis justo in hac,5,2021-11-27
5382,amet nunc viverra dapibus nulla,4,2021-11-18
5383,donec dapibus duis at velit eu,2,2022-09-17
5384,eget massa tempor convallis nulla neque,4,2022-03-16
5385,amet nunc viverra dapibus nulla,4,2022-09-26
5386,at velit vivamus vel nulla,3,2022-02-03
5387,at nunc commodo placerat praesent blandit,2,2021-11-27
5388,vestibulum ante ipsum primis in faucibus,2,2022-06-14
5389,ut odio cras mi,1,2021-12-28
5390,etiam faucibus cursus urna ut tellus,4,2022-07-17
5391,ligula nec sem duis aliquam,5,2022-05-24
5392,metus arcu adipiscing molestie,3,2021-12-15
5393,porttitor id consequat in consequat ut,2,2022-06-01
5394,faucibus orci luctus et ultrices,2,2022-09-08
5395,ullamcorper purus sit amet nulla,1,2022-07-31
5396,posuere cubilia curae nulla,3,2022-03-26
5397,vitae mattis nibh ligula,3,2021-12-03
5398,semper porta volutpat quam,3,2022-01-08
5399,massa id lobortis convallis,1,2022-07-09
5400,tortor duis mattis egestas metus,5,2021-11-19
5401,suspendisse potenti cras in purus,4,2022-10-17
5402,fusce consequat nulla nisl nunc,3,2021-12-20
