1,tellus nulla ut erat id mauris,4,2021-12-30
2,leo rhoncus sed vestibulum sit,1,2022-03-05
3,enim sit amet nunc viverra,3,2022-07-23
4,fringilla rhoncus mauris enim leo,3,2021-12-10
5,eget tincidunt eget tempus vel,2,2022-07-09
6,lobortis est phasellus sit amet,7,2022-08-12
7,ut mauris eget massa tempor,1,2022-02-11
8,ultrices posuere cubilia curae donec pharetra,4,2022-01-19
9,eu interdum eu tincidunt in,2,2021-11-04
10,velit vivamus vel nulla eget,4,2022-03-07
11,nunc vestibulum ante ipsum primis,5,2022-06-18
12,massa donec dapibus duis at velit,6,2022-01-30
13,viverra eget congue eget semper,5,2022-06-17
14,nisl venenatis lacinia aenean sit amet,1,2022-04-02
15,etiam faucibus cursus urna ut tellus,7,2022-06-13
16,sapien cum sociis natoque penatibus et,7,2022-09-30
17,arcu sed augue aliquam erat volutpat,7,2022-03-14
18,dolor vel est donec odio,6,2022-09-15
19,sed nisl nunc rhoncus dui,5,2022-02-09
20,at ipsum ac tellus semper,7,2022-10-11
21,sit amet turpis elementum ligula,1,2022-06-21
22,luctus ultricies eu nibh quisque,6,2022-04-18
23,luctus nec molestie sed justo,1,2022-08-27
24,aenean auctor gravida sem praesent id,3,2022-02-19
25,eget rutrum at lorem integer,2,2022-07-06
26,viverra eget congue eget semper,1,2021-11-23
27,in lacus curabitur at ipsum,3,2022-01-09
28,vestibulum rutrum rutrum neque aenean auctor,1,2022-08-02
29,varius nulla facilisi cras non,6,2022-09-13
30,leo odio porttitor id consequat in,7,2022-07-28
31,volutpat eleifend donec ut dolor,6,2021-11-17
32,leo pellentesque ultrices mattis odio,2,2022-04-05
33,hac habitasse platea dictumst maecenas ut,1,2022-01-26
34,nulla sed accumsan felis ut,7,2022-02-22
35,mauris ullamcorper purus sit amet nulla,6,2022-04-01
36,semper rutrum nulla nunc purus,5,2022-08-11
37,eget tincidunt eget tempus vel,4,2022-10-27
38,vel lectus in quam fringilla,1,2022-06-12
39,vulputate luctus cum sociis natoque penatibus,1,2022-07-08
40,semper interdum mauris ullamcorper purus sit,5,2022-04-09
41,congue eget semper rutrum nulla nunc,1,2022-06-01
42,nec dui luctus rutrum nulla tellus,3,2022-09-27
43,ante ipsum primis in faucibus orci,4,2022-10-29
44,libero nullam sit amet turpis,6,2022-08-17
45,nulla eget eros elementum pellentesque,6,2022-07-17
46,sodales sed tincidunt eu felis,4,2022-06-23
47,nulla ut erat id mauris vulputate,5,2022-02-27
48,faucibus orci luctus et ultrices,3,2022-07-08
49,nonummy maecenas tincidunt lacus at velit,2,2021-11-13
50,eros vestibulum ac est lacinia,6,2022-06-14
51,morbi non lectus aliquam sit amet,2,2022-07-06
52,nec dui luctus rutrum nulla tellus,1,2022-08-02
53,sit amet justo morbi ut odio,4,2022-10-07
54,tempus vivamus in felis eu,7,2022-09-21
55,in lectus pellentesque at nulla,4,2022-03-28
56,praesent id massa id nisl,3,2021-12-12
57,mi sit amet lobortis sapien,2,2022-08-21
58,convallis nunc proin at turpis a,7,2022-08-30
59,nec sem duis aliquam convallis,5,2022-07-08
60,vestibulum ante ipsum primis in,4,2021-11-04
61,praesent lectus vestibulum quam sapien,4,2022-04-14
62,etiam pretium iaculis justo in hac,3,2022-04-22
63,ac leo pellentesque ultrices mattis,7,2022-06-08
64,felis donec semper sapien a,1,2022-07-13
65,nisl nunc rhoncus dui vel,1,2022-04-05
66,in lacus curabitur at ipsum ac,7,2022-06-25
67,magna ac consequat metus sapien,6,2022-07-23
68,dolor sit amet consectetuer adipiscing,3,2022-02-25
69,justo etiam pretium iaculis justo in,4,2022-10-28
70,volutpat quam pede lobortis ligula sit,2,2021-12-31
71,ac nibh fusce lacus purus,3,2022-06-14
72,cras in purus eu magna,1,2022-02-14
73,mauris lacinia sapien quis libero,7,2022-10-17
74,orci nullam molestie nibh in,6,2022-03-22
75,mattis egestas metus aenean fermentum,6,2022-10-31
76,sit amet nulla quisque arcu libero,5,2021-12-05
77,risus dapibus augue vel accumsan,3,2022-07-19
78,duis aliquam convallis nunc proin,7,2022-01-30
79,felis ut at dolor quis odio,6,2022-02-12
80,donec dapibus duis at velit,3,2022-06-04
81,hac habitasse platea dictumst morbi vestibulum,5,2021-12-18
82,nec condimentum neque sapien placerat ante,3,2022-10-05
83,id nisl venenatis lacinia aenean sit,7,2022-09-16
84,felis sed lacus morbi sem mauris,3,2022-09-02
85,dolor morbi vel lectus in,6,2022-06-08
86,donec dapibus duis at velit,3,2022-05-23
87,enim blandit mi in porttitor,6,2022-04-22
88,amet nulla quisque arcu libero rutrum,7,2022-05-02
89,mauris laoreet ut rhoncus aliquet,6,2022-08-28
90,eget congue eget semper rutrum,4,2021-11-03
91,nibh fusce lacus purus aliquet,6,2021-12-08
92,nibh in quis justo maecenas,2,2022-04-10
93,amet erat nulla tempus vivamus in,2,2022-09-08
94,vehicula condimentum curabitur in libero,4,2022-09-29
95,non mi integer ac neque duis,6,2022-06-14
96,mauris lacinia sapien quis libero,3,2022-10-07
97,ultrices mattis odio donec vitae,4,2022-05-11
98,lorem quisque ut erat curabitur gravida,4,2022-01-23
99,nibh in hac habitasse platea dictumst,6,2022-06-29
100,pellentesque quisque porta volutpat erat quisque,5,2022-07-27
101,mus vivamus vestibulum sagittis sapien cum,7,2022-10-28
102,id mauris vulputate elementum nullam varius,1,2021-11-24
103,viverra dapibus nulla suscipit ligula,3,2022-06-30
104,nulla neque libero convallis eget eleifend,7,2022-03-10
105,congue eget semper rutrum nulla,2,2022-02-01
106,risus semper porta volutpat quam,6,2022-10-29
107,cursus id turpis integer aliquet,5,2022-09-07
108,integer pede justo lacinia eget tincidunt,3,2022-06-01
109,potenti nullam porttitor lacus at,7,2022-08-28
110,eu interdum eu tincidunt in,3,2022-07-31
111,quam a odio in hac,7,2022-07-29
112,nisl venenatis lacinia aenean sit amet,4,2022-09-10
113,ut erat id mauris vulputate elementum,6,2022-06-09
114,proin interdum mauris non ligula,6,2021-12-22
115,etiam justo etiam pretium iaculis,6,2022-02-22
116,quam pharetra magna ac consequat metus,6,2021-11-24
117,nullam varius nulla facilisi cras non,1,2022-01-31
118,morbi ut odio cras mi pede,5,2022-08-05
119,convallis morbi odio odio elementum,6,2021-11-07
120,in quam fringilla rhoncus mauris enim,6,2021-11-30
121,mi nulla ac enim in,4,2022-01-07
122,sem praesent id massa id,2,2022-07-28
123,nulla facilisi cras non velit,1,2021-11-16
124,congue risus semper porta volutpat quam,4,2021-12-24
125,at velit vivamus vel nulla,7,2022-03-02
126,augue vel accumsan tellus nisi,6,2021-11-22
127,platea dictumst aliquam augue quam,6,2022-10-09
128,potenti nullam porttitor lacus at turpis,1,2022-05-14
129,donec semper sapien a libero nam,7,2022-07-13
130,nibh quisque id justo sit,6,2022-01-19
131,vulputate justo in blandit ultrices,3,2022-09-01
132,nam ultrices libero non mattis pulvinar,2,2022-02-19
133,ultrices posuere cubilia curae mauris,3,2022-10-23
134,blandit nam nulla integer pede,6,2022-01-24
135,tellus nisi eu orci mauris lacinia,5,2022-08-29
136,quis orci nullam molestie nibh in,6,2021-11-19
137,purus aliquet at feugiat non,1,2022-09-22
138,sem praesent id massa id,5,2022-03-24
139,lobortis vel dapibus at diam,2,2022-04-15
140,facilisi cras non velit nec nisi,2,2022-05-24
141,vivamus in felis eu sapien,2,2022-03-01
142,orci eget orci vehicula condimentum,1,2022-05-02
143,a pede posuere nonummy integer,5,2022-07-09
144,ut tellus nulla ut erat,7,2022-01-13
145,a suscipit nulla elit ac nulla,6,2021-11-17
146,natoque penatibus et magnis dis parturient,3,2022-04-19
147,odio curabitur convallis duis consequat,1,2022-01-14
148,sed vel enim sit amet,2,2022-10-18
149,erat fermentum justo nec condimentum,2,2022-01-05
150,sed sagittis nam congue risus,2,2021-12-24
151,morbi ut odio cras mi pede,3,2021-11-11
152,aliquet ultrices erat tortor sollicitudin mi,5,2021-11-26
153,pretium iaculis diam erat fermentum justo,4,2021-12-23
154,eleifend pede libero quis orci,6,2021-12-08
155,in tempus sit amet sem fusce,6,2022-03-19
156,et commodo vulputate justo in,2,2022-10-05
157,vitae consectetuer eget rutrum at,1,2022-10-25
158,tincidunt nulla mollis molestie lorem quisque,5,2022-07-07
159,quam sollicitudin vitae consectetuer eget,2,2022-05-02
160,cursus urna ut tellus nulla ut,2,2022-09-09
161,magna vulputate luctus cum sociis natoque,5,2022-03-30
162,semper rutrum nulla nunc purus,3,2022-07-14
163,faucibus cursus urna ut tellus,3,2022-01-15
164,quam sollicitudin vitae consectetuer eget rutrum,2,2022-10-12
165,nisl ut volutpat sapien arcu sed,3,2022-04-27
166,in sapien iaculis congue vivamus metus,7,2022-10-16
167,curabitur at ipsum ac tellus semper,3,2022-08-04
168,orci vehicula condimentum curabitur in,1,2022-08-16
169,accumsan odio curabitur convallis duis,2,2022-02-12
170,odio cras mi pede malesuada in,2,2022-09-21
171,leo odio condimentum id luctus nec,6,2022-10-14
172,semper rutrum nulla nunc purus,6,2022-05-24
173,pede malesuada in imperdiet et commodo,1,2022-06-18
174,etiam justo etiam pretium iaculis justo,3,2022-06-23
175,eu sapien cursus vestibulum proin eu,5,2022-05-12
176,nisi venenatis tristique fusce congue diam,3,2022-10-11
177,magna bibendum imperdiet nullam orci pede,4,2022-08-11
178,congue diam id ornare imperdiet,6,2022-04-07
179,ac nulla sed vel enim sit,4,2022-05-26
180,nunc viverra dapibus nulla suscipit ligula,7,2022-04-10
181,vitae nisi nam ultrices libero,4,2021-12-18
182,fusce posuere felis sed lacus,7,2022-02-04
183,sit amet cursus id turpis integer,6,2022-07-23
184,pretium nisl ut volutpat sapien arcu,3,2021-11-27
185,amet eleifend pede libero quis orci,7,2022-01-23
186,quis justo maecenas rhoncus aliquam,6,2022-07-10
187,pede lobortis ligula sit amet eleifend,5,2022-10-30
188,gravida nisi at nibh in hac,6,2022-05-24
189,dictumst aliquam augue quam sollicitudin vitae,1,2022-07-17
190,id ligula suspendisse ornare consequat,3,2022-10-16
191,in hac habitasse platea dictumst morbi,1,2022-10-19
192,eleifend quam a odio in hac,7,2022-03-23
193,et magnis dis parturient montes nascetur,4,2022-04-30
194,natoque penatibus et magnis dis,7,2021-12-26
195,adipiscing elit proin interdum mauris non,4,2021-12-12
196,et ultrices posuere cubilia curae duis,3,2022-08-03
197,metus vitae ipsum aliquam non,7,2022-07-18
198,sit amet consectetuer adipiscing elit proin,1,2022-01-14
199,duis ac nibh fusce lacus,7,2022-06-09
200,duis aliquam convallis nunc proin,1,2022-08-27
201,sed tristique in tempus sit,7,2022-09-29
202,rhoncus aliquam lacus morbi quis,2,2022-01-12
203,orci luctus et ultrices posuere cubilia,2,2021-11-12
204,aliquam quis turpis eget elit sodales,7,2022-03-18
205,ridiculus mus vivamus vestibulum sagittis,1,2022-07-10
206,felis sed lacus morbi sem,2,2021-11-21
207,ligula in lacus curabitur at ipsum,2,2022-06-03
208,sapien urna pretium nisl ut volutpat,7,2022-10-20
209,massa volutpat convallis morbi odio odio,5,2022-10-23
210,diam id ornare imperdiet sapien,4,2022-01-16
211,in lectus pellentesque at nulla,6,2022-01-14
212,in quis justo maecenas rhoncus aliquam,5,2022-07-12
213,eleifend donec ut dolor morbi vel,4,2022-06-11
214,nunc viverra dapibus nulla suscipit,5,2022-02-17
215,tincidunt eget tempus vel pede,3,2022-02-17
216,felis sed interdum venenatis turpis,6,2022-02-09
217,sagittis nam congue risus semper porta,4,2022-06-26
218,vitae mattis nibh ligula nec sem,5,2022-02-10
219,fermentum justo nec condimentum neque,5,2022-03-04
220,dui luctus rutrum nulla tellus,4,2022-04-25
221,ac leo pellentesque ultrices mattis,2,2022-03-17
222,volutpat dui maecenas tristique est,1,2021-12-28
223,ut tellus nulla ut erat id,1,2022-10-09
224,parturient montes nascetur ridiculus mus vivamus,1,2021-11-25
225,amet erat nulla tempus vivamus in,1,2022-03-31
226,eleifend donec ut dolor morbi,3,2021-11-19
227,ligula pellentesque ultrices phasellus id,1,2022-06-04
228,et magnis dis parturient montes nascetur,4,2022-09-21
229,luctus cum sociis natoque penatibus,4,2022-10-15
230,sit amet cursus id turpis integer,2,2022-10-31
231,habitasse platea dictumst aliquam augue quam,5,2022-06-27
232,eros elementum pellentesque quisque porta,4,2022-10-07
233,magna ac consequat metus sapien,5,2022-05-17
234,in congue etiam justo etiam pretium,6,2021-11-18
235,non velit donec diam neque,3,2022-02-12
236,imperdiet sapien urna pretium nisl,2,2022-05-22
237,augue aliquam erat volutpat in,4,2022-05-20
238,justo aliquam quis turpis eget,5,2022-08-11
239,platea dictumst aliquam augue quam,5,2021-12-28
240,ipsum aliquam non mauris morbi non,7,2021-12-08
241,lacinia eget tincidunt eget tempus,1,2022-04-29
242,in quam fringilla rhoncus mauris,4,2022-04-25
243,etiam vel augue vestibulum rutrum rutrum,7,2022-02-21
244,fermentum justo nec condimentum neque sapien,4,2021-12-22
245,sapien varius ut blandit non,3,2022-01-02
246,habitasse platea dictumst etiam faucibus,4,2022-01-28
247,eget eros elementum pellentesque quisque,1,2022-05-19
248,eget massa tempor convallis nulla,4,2022-01-17
249,quis orci nullam molestie nibh in,6,2022-06-02
250,id luctus nec molestie sed justo,3,2022-08-24
251,eleifend donec ut dolor morbi,5,2021-12-10
252,libero convallis eget eleifend luctus,3,2022-06-03
253,curae mauris viverra diam vitae quam,4,2022-07-29
254,vulputate nonummy maecenas tincidunt lacus,6,2022-05-21
255,ut massa volutpat convallis morbi,3,2022-03-26
256,odio elementum eu interdum eu,5,2022-10-19
257,morbi vestibulum velit id pretium iaculis,6,2022-04-15
258,duis bibendum morbi non quam nec,2,2021-12-10
259,ante nulla justo aliquam quis turpis,5,2022-10-18
260,habitasse platea dictumst maecenas ut massa,7,2021-11-07
261,vivamus tortor duis mattis egestas,3,2021-12-29
262,pede justo eu massa donec dapibus,7,2022-06-28
263,sociis natoque penatibus et magnis,4,2022-08-24
264,platea dictumst morbi vestibulum velit,2,2022-09-28
265,in quis justo maecenas rhoncus,1,2022-05-11
266,eget tincidunt eget tempus vel,3,2021-11-15
267,pharetra magna ac consequat metus,4,2022-10-16
268,sapien non mi integer ac neque,4,2022-02-16
269,venenatis turpis enim blandit mi,2,2021-12-29
270,tellus semper interdum mauris ullamcorper,7,2022-06-09
271,fermentum donec ut mauris eget,1,2021-12-02
272,lacinia nisi venenatis tristique fusce,5,2022-06-15
273,nullam sit amet turpis elementum ligula,4,2022-06-23
274,donec ut dolor morbi vel,1,2022-02-07
275,faucibus orci luctus et ultrices,3,2022-02-03
276,dis parturient montes nascetur ridiculus,5,2022-01-30
277,posuere cubilia curae donec pharetra magna,5,2022-09-01
278,malesuada in imperdiet et commodo vulputate,5,2022-05-24
279,libero convallis eget eleifend luctus,3,2022-04-09
280,posuere metus vitae ipsum aliquam,3,2021-11-25
281,pharetra magna vestibulum aliquet ultrices,2,2022-10-28
282,vel est donec odio justo,4,2022-02-27
283,diam neque vestibulum eget vulputate ut,3,2022-01-05
284,orci luctus et ultrices posuere cubilia,4,2022-03-13
285,lobortis convallis tortor risus dapibus augue,5,2022-07-15
286,arcu adipiscing molestie hendrerit at,6,2021-11-10
287,hac habitasse platea dictumst aliquam,1,2022-01-19
288,eget massa tempor convallis nulla,7,2022-02-16
289,aliquam sit amet diam in,6,2022-09-29
290,habitasse platea dictumst aliquam augue quam,7,2021-11-07
291,sagittis nam congue risus semper porta,5,2021-11-25
292,dictumst aliquam augue quam sollicitudin,3,2022-07-29
293,faucibus orci luctus et ultrices posuere,6,2022-08-18
294,proin risus praesent lectus vestibulum quam,3,2022-06-24
295,phasellus sit amet erat nulla tempus,7,2021-12-12
296,etiam faucibus cursus urna ut,1,2022-06-08
297,pharetra magna ac consequat metus sapien,3,2022-02-07
298,ac leo pellentesque ultrices mattis odio,5,2022-08-18
299,luctus cum sociis natoque penatibus et,6,2021-12-04
300,ipsum integer a nibh in,5,2021-11-16
301,erat nulla tempus vivamus in,6,2022-05-13
302,pede ac diam cras pellentesque volutpat,4,2022-01-23
303,nibh in quis justo maecenas rhoncus,6,2022-04-11
304,a feugiat et eros vestibulum ac,3,2022-08-21
305,sit amet consectetuer adipiscing elit proin,3,2022-04-10
306,quis augue luctus tincidunt nulla,5,2022-06-07
307,curabitur gravida nisi at nibh in,3,2021-12-07
308,ante vestibulum ante ipsum primis,5,2022-08-05
309,at vulputate vitae nisl aenean lectus,5,2022-03-01
310,id ligula suspendisse ornare consequat,6,2022-01-30
311,vestibulum sagittis sapien cum sociis,1,2022-09-04
312,ultrices posuere cubilia curae mauris viverra,1,2022-06-11
313,aliquet at feugiat non pretium quis,1,2022-08-09
314,sapien cursus vestibulum proin eu mi,1,2021-11-13
315,erat id mauris vulputate elementum nullam,7,2022-08-16
316,maecenas tristique est et tempus,1,2022-06-10
317,convallis nunc proin at turpis a,1,2022-05-19
318,cursus vestibulum proin eu mi,3,2022-01-07
319,ultrices enim lorem ipsum dolor,3,2021-12-27
320,ut rhoncus aliquet pulvinar sed nisl,2,2022-02-09
321,lectus pellentesque eget nunc donec quis,3,2022-05-02
322,rutrum neque aenean auctor gravida sem,4,2022-05-07
323,tortor risus dapibus augue vel accumsan,7,2022-01-14
324,in faucibus orci luctus et,3,2022-07-08
325,volutpat sapien arcu sed augue,1,2021-11-12
326,sed nisl nunc rhoncus dui,5,2021-11-12
327,nec condimentum neque sapien placerat,7,2022-08-21
328,montes nascetur ridiculus mus vivamus,7,2022-04-16
329,a libero nam dui proin,2,2022-07-03
330,pellentesque volutpat dui maecenas tristique est,4,2022-03-26
331,felis eu sapien cursus vestibulum proin,1,2022-10-19
332,habitasse platea dictumst morbi vestibulum,6,2022-01-11
333,nunc proin at turpis a,7,2022-04-29
334,erat eros viverra eget congue eget,5,2022-01-14
335,ac nibh fusce lacus purus,2,2021-12-21
336,nullam sit amet turpis elementum ligula,2,2022-07-19
337,massa id lobortis convallis tortor risus,3,2021-11-01
338,tellus nisi eu orci mauris,7,2022-03-10
339,congue vivamus metus arcu adipiscing,5,2022-10-01
340,nam tristique tortor eu pede,7,2022-05-21
341,gravida sem praesent id massa,5,2021-11-08
342,quam turpis adipiscing lorem vitae mattis,1,2022-03-26
343,in imperdiet et commodo vulputate justo,3,2022-06-15
344,amet sapien dignissim vestibulum vestibulum,1,2022-09-14
345,nec nisi vulputate nonummy maecenas tincidunt,1,2022-09-07
346,ante vel ipsum praesent blandit,2,2022-08-27
347,fermentum donec ut mauris eget massa,3,2022-01-31
348,vehicula condimentum curabitur in libero ut,5,2022-10-17
349,luctus et ultrices posuere cubilia curae,7,2022-02-15
350,neque aenean auctor gravida sem,7,2022-06-27
351,erat vestibulum sed magna at,7,2022-10-23
352,at velit eu est congue,3,2022-05-15
353,nulla ac enim in tempor turpis,7,2022-01-17
354,tincidunt ante vel ipsum praesent,6,2022-01-10
355,phasellus in felis donec semper,7,2022-02-06
356,id mauris vulputate elementum nullam varius,2,2021-11-20
357,eu est congue elementum in,3,2022-10-18
358,turpis nec euismod scelerisque quam turpis,7,2021-11-19
359,proin risus praesent lectus vestibulum quam,4,2022-10-05
360,augue quam sollicitudin vitae consectetuer eget,6,2022-07-27
361,adipiscing lorem vitae mattis nibh ligula,2,2022-02-11
362,nisi venenatis tristique fusce congue diam,2,2022-02-26
363,luctus cum sociis natoque penatibus et,4,2021-11-12
364,aliquet ultrices erat tortor sollicitudin mi,7,2021-12-21
365,cras in purus eu magna,2,2022-03-17
366,mauris vulputate elementum nullam varius nulla,7,2021-11-20
367,nibh ligula nec sem duis aliquam,7,2022-05-05
368,nunc donec quis orci eget orci,3,2022-08-07
369,duis bibendum morbi non quam nec,1,2021-11-16
370,parturient montes nascetur ridiculus mus vivamus,6,2022-10-04
371,libero quis orci nullam molestie,6,2022-08-26
372,interdum venenatis turpis enim blandit mi,5,2021-11-10
373,sed tristique in tempus sit,4,2021-12-28
374,dolor sit amet consectetuer adipiscing elit,4,2022-07-20
375,pede lobortis ligula sit amet eleifend,7,2022-05-22
376,a pede posuere nonummy integer,2,2022-03-28
377,eu nibh quisque id justo,1,2021-11-02
378,odio curabitur convallis duis consequat,2,2022-01-24
379,lacus at velit vivamus vel nulla,6,2022-09-05
380,ut nulla sed accumsan felis ut,1,2022-05-07
381,tempor convallis nulla neque libero,4,2022-03-02
382,mauris eget massa tempor convallis,3,2022-01-02
383,potenti cras in purus eu magna,5,2021-11-30
384,fringilla rhoncus mauris enim leo rhoncus,4,2022-01-05
385,natoque penatibus et magnis dis parturient,1,2022-02-23
386,libero nullam sit amet turpis,6,2022-04-27
387,posuere metus vitae ipsum aliquam non,1,2021-11-25
388,congue elementum in hac habitasse platea,2,2022-01-27
389,parturient montes nascetur ridiculus mus vivamus,2,2022-07-26
390,dictumst aliquam augue quam sollicitudin vitae,1,2022-03-14
391,pede lobortis ligula sit amet eleifend,6,2022-03-15
392,sapien iaculis congue vivamus metus arcu,3,2022-01-20
393,cum sociis natoque penatibus et,5,2022-06-22
394,luctus et ultrices posuere cubilia curae,1,2022-02-27
395,non lectus aliquam sit amet,5,2022-08-01
396,cras in purus eu magna,3,2022-09-22
397,dictumst etiam faucibus cursus urna,4,2022-07-31
398,laoreet ut rhoncus aliquet pulvinar,1,2022-09-23
399,risus dapibus augue vel accumsan tellus,3,2022-06-16
400,dolor quis odio consequat varius,5,2022-03-05
401,at velit eu est congue,6,2022-09-25
402,a ipsum integer a nibh,4,2022-09-14
403,nibh in hac habitasse platea dictumst,6,2021-12-23
404,purus phasellus in felis donec,5,2021-11-05
405,sed justo pellentesque viverra pede,2,2022-08-02
406,volutpat in congue etiam justo etiam,7,2022-06-07
407,porttitor lorem id ligula suspendisse ornare,1,2021-12-21
408,cubilia curae nulla dapibus dolor,1,2022-07-26
409,volutpat sapien arcu sed augue,3,2021-11-08
410,et tempus semper est quam,3,2022-06-13
411,et ultrices posuere cubilia curae,7,2022-09-24
412,lacus purus aliquet at feugiat,2,2021-11-23
413,massa id lobortis convallis tortor risus,5,2022-09-05
414,blandit mi in porttitor pede,4,2022-08-04
415,bibendum felis sed interdum venenatis turpis,4,2022-01-25
416,orci mauris lacinia sapien quis libero,4,2021-12-18
417,amet lobortis sapien sapien non mi,6,2022-02-11
418,quisque porta volutpat erat quisque erat,6,2021-11-24
419,ipsum praesent blandit lacinia erat vestibulum,2,2022-10-03
420,vulputate elementum nullam varius nulla facilisi,4,2022-08-08
421,felis sed interdum venenatis turpis,3,2022-04-29
422,vehicula condimentum curabitur in libero ut,5,2022-03-27
423,volutpat convallis morbi odio odio,5,2022-02-01
424,id nisl venenatis lacinia aenean,5,2022-10-19
425,aliquet at feugiat non pretium,6,2022-06-26
426,scelerisque quam turpis adipiscing lorem,4,2022-05-29
427,turpis eget elit sodales scelerisque,4,2022-04-14
428,ut blandit non interdum in,7,2022-04-25
429,erat eros viverra eget congue,5,2021-12-03
430,pretium nisl ut volutpat sapien,7,2022-03-16
431,lorem ipsum dolor sit amet consectetuer,7,2022-02-09
432,mi pede malesuada in imperdiet et,7,2022-03-30
433,ac diam cras pellentesque volutpat,6,2021-11-15
434,mattis odio donec vitae nisi,3,2022-03-21
435,amet nulla quisque arcu libero rutrum,1,2022-02-12
436,vestibulum velit id pretium iaculis diam,3,2022-08-10
437,habitasse platea dictumst etiam faucibus,1,2022-07-03
438,vestibulum eget vulputate ut ultrices vel,5,2022-08-06
439,eget nunc donec quis orci eget,5,2022-02-27
440,sapien cum sociis natoque penatibus,1,2021-12-08
441,justo etiam pretium iaculis justo in,2,2022-02-10
442,quam pharetra magna ac consequat metus,5,2022-05-29
443,non mattis pulvinar nulla pede,3,2021-12-22
444,praesent lectus vestibulum quam sapien,5,2022-07-31
445,amet diam in magna bibendum,3,2022-08-15
446,ante vestibulum ante ipsum primis,2,2022-04-15
447,orci luctus et ultrices posuere cubilia,4,2022-10-11
448,ultrices libero non mattis pulvinar,1,2022-08-30
449,faucibus accumsan odio curabitur convallis,6,2022-01-31
450,amet sem fusce consequat nulla nisl,6,2022-05-25
451,quam fringilla rhoncus mauris enim leo,6,2022-10-05
452,sagittis sapien cum sociis natoque penatibus,6,2022-09-30
453,odio condimentum id luctus nec,6,2022-06-16
454,fusce lacus purus aliquet at,6,2022-09-10
455,elit sodales scelerisque mauris sit amet,6,2021-12-15
456,eleifend donec ut dolor morbi,7,2021-12-28
457,et ultrices posuere cubilia curae,7,2022-07-29
458,ac consequat metus sapien ut,2,2021-11-02
459,gravida sem praesent id massa,2,2022-08-13
460,elementum nullam varius nulla facilisi,1,2022-06-25
461,quis odio consequat varius integer,6,2022-01-02
462,pellentesque volutpat dui maecenas tristique est,7,2022-07-29
463,pulvinar nulla pede ullamcorper augue,6,2022-03-20
464,eros viverra eget congue eget,6,2022-02-26
465,ipsum ac tellus semper interdum,4,2022-07-08
466,molestie hendrerit at vulputate vitae,1,2021-12-20
467,nisi volutpat eleifend donec ut,2,2022-05-19
468,vestibulum eget vulputate ut ultrices vel,2,2022-03-16
469,odio odio elementum eu interdum,5,2022-10-09
470,nullam varius nulla facilisi cras non,7,2022-02-25
471,vulputate ut ultrices vel augue vestibulum,3,2022-01-01
472,vitae consectetuer eget rutrum at,5,2022-06-18
473,sit amet consectetuer adipiscing elit,2,2022-02-11
474,quisque porta volutpat erat quisque erat,2,2022-09-22
475,rutrum nulla nunc purus phasellus in,3,2022-08-25
476,mauris sit amet eros suspendisse accumsan,3,2022-08-11
477,nibh in lectus pellentesque at,4,2021-11-22
478,neque sapien placerat ante nulla justo,4,2021-11-08
479,semper rutrum nulla nunc purus phasellus,4,2022-02-08
480,vivamus metus arcu adipiscing molestie,1,2022-04-11
481,consequat metus sapien ut nunc,7,2021-12-16
482,nulla tempus vivamus in felis eu,4,2022-02-06
483,turpis a pede posuere nonummy,5,2022-05-09
484,pellentesque eget nunc donec quis orci,6,2022-01-23
485,non ligula pellentesque ultrices phasellus,4,2021-12-12
486,in congue etiam justo etiam,4,2021-12-30
487,dapibus dolor vel est donec odio,4,2022-04-14
488,morbi odio odio elementum eu interdum,2,2022-02-20
489,eget tincidunt eget tempus vel pede,7,2022-04-30
490,adipiscing lorem vitae mattis nibh,7,2022-06-15
491,orci pede venenatis non sodales,7,2022-04-13
492,semper interdum mauris ullamcorper purus,2,2022-04-21
493,luctus et ultrices posuere cubilia curae,1,2022-05-16
494,maecenas pulvinar lobortis est phasellus,2,2022-10-21
495,ligula suspendisse ornare consequat lectus in,4,2022-04-20
496,ultrices posuere cubilia curae nulla,1,2022-10-28
497,mi pede malesuada in imperdiet et,4,2022-04-07
498,ligula vehicula consequat morbi a,5,2022-04-18
