2457,donec posuere metus vitae ipsum aliquam,3,2022-05-02
2458,tincidunt in leo maecenas pulvinar,5,2022-02-10
2459,ut erat curabitur gravida nisi at,5,2021-12-28
2460,nec nisi volutpat eleifend donec,4,2022-04-05
2461,diam erat fermentum justo nec,2,2022-03-12
2462,quam pede lobortis ligula sit,1,2022-09-19
2463,sed augue aliquam erat volutpat,4,2022-05-16
2464,sem praesent id massa id,2,2022-02-21
2465,fermentum justo nec condimentum neque,1,2022-03-26
2466,ultrices erat tortor sollicitudin mi sit,2,2022-08-16
2467,nec nisi volutpat eleifend donec,5,2022-06-27
2468,eros elementum pellentesque quisque porta volutpat,1,2022-04-21
2469,non pretium quis lectus suspendisse potenti,4,2022-07-10
2470,blandit non interdum in ante,2,2022-06-15
2471,nonummy maecenas tincidunt lacus at velit,5,2022-03-04
2472,nisi vulputate nonummy maecenas tincidunt,4,2022-01-02
2473,in tempor turpis nec euismod scelerisque,3,2022-09-02
2474,felis fusce posuere felis sed lacus,4,2022-01-21
2475,mauris ullamcorper purus sit amet nulla,7,2021-11-21
2476,massa volutpat convallis morbi odio odio,1,2022-09-18
2477,nascetur ridiculus mus etiam vel,3,2021-12-23
2478,quis libero nullam sit amet turpis,4,2022-07-21
2479,pretium nisl ut volutpat sapien,1,2022-09-30
2480,duis bibendum morbi non quam,4,2022-03-15
2481,curabitur convallis duis consequat dui,3,2022-05-05
2482,ut suscipit a feugiat et eros,6,2021-11-22
2483,dolor quis odio consequat varius,3,2022-09-22
2484,et commodo vulputate justo in,4,2022-10-12
2485,feugiat et eros vestibulum ac,2,2021-11-05
2486,nulla tempus vivamus in felis eu,2,2022-02-01
2487,est donec odio justo sollicitudin,6,2022-03-27
2488,at nulla suspendisse potenti cras,5,2022-10-11
2489,ipsum primis in faucibus orci luctus,7,2022-01-14
2490,vitae mattis nibh ligula nec,3,2021-11-28
2491,accumsan felis ut at dolor,3,2022-01-17
2492,justo in hac habitasse platea dictumst,3,2022-01-30
2493,pretium iaculis diam erat fermentum,5,2022-05-18
2494,eu massa donec dapibus duis,3,2022-09-21
2495,erat id mauris vulputate elementum,3,2022-05-02
2496,etiam pretium iaculis justo in,3,2022-03-05
2497,penatibus et magnis dis parturient montes,7,2022-08-12
2498,tempor turpis nec euismod scelerisque quam,7,2022-08-05
2499,curabitur convallis duis consequat dui nec,3,2022-03-10
2500,est risus auctor sed tristique,4,2021-12-04
2501,in consequat ut nulla sed,5,2022-01-03
2502,hac habitasse platea dictumst etiam faucibus,2,2022-02-04
2503,platea dictumst morbi vestibulum velit,1,2022-10-09
2504,a odio in hac habitasse,2,2021-12-13
2505,amet nulla quisque arcu libero rutrum,6,2022-09-02
2506,et eros vestibulum ac est lacinia,2,2022-06-27
2507,risus auctor sed tristique in tempus,6,2022-05-19
2508,ipsum ac tellus semper interdum,1,2022-07-14
2509,duis ac nibh fusce lacus purus,5,2022-04-17
2510,eu est congue elementum in hac,6,2022-02-24
2511,fusce congue diam id ornare,6,2021-11-16
2512,enim lorem ipsum dolor sit amet,7,2022-03-20
2513,odio justo sollicitudin ut suscipit,6,2022-03-04
2514,velit nec nisi vulputate nonummy maecenas,5,2022-01-23
2515,aenean sit amet justo morbi ut,3,2022-05-02
2516,quam turpis adipiscing lorem vitae mattis,3,2022-09-22
2517,fusce lacus purus aliquet at feugiat,1,2022-05-23
2518,aliquet massa id lobortis convallis,6,2022-01-09
2519,ultrices posuere cubilia curae duis faucibus,1,2021-11-25
2520,mauris non ligula pellentesque ultrices phasellus,3,2022-06-26
2521,odio porttitor id consequat in,4,2022-08-16
2522,pharetra magna vestibulum aliquet ultrices,2,2022-03-25
2523,venenatis tristique fusce congue diam,5,2022-07-22
2524,ut blandit non interdum in,1,2022-04-02
2525,fringilla rhoncus mauris enim leo,7,2022-03-29
2526,pellentesque viverra pede ac diam cras,6,2022-04-02
2527,duis bibendum morbi non quam,3,2022-02-25
2528,vel dapibus at diam nam,7,2022-06-25
2529,luctus ultricies eu nibh quisque,7,2022-02-15
2530,curabitur at ipsum ac tellus semper,5,2022-04-03
2531,vestibulum sit amet cursus id turpis,5,2022-06-29
2532,sed vestibulum sit amet cursus id,4,2022-01-22
2533,volutpat in congue etiam justo etiam,2,2022-03-29
2534,tortor sollicitudin mi sit amet lobortis,4,2022-04-16
2535,at velit eu est congue,1,2022-10-28
2536,interdum in ante vestibulum ante,2,2022-04-15
2537,congue vivamus metus arcu adipiscing molestie,7,2022-08-11
2538,ut nulla sed accumsan felis ut,7,2022-06-09
2539,penatibus et magnis dis parturient,3,2022-04-20
2540,etiam vel augue vestibulum rutrum rutrum,4,2022-02-22
2541,pede ullamcorper augue a suscipit,3,2022-02-09
2542,in hac habitasse platea dictumst,6,2021-12-14
2543,vulputate nonummy maecenas tincidunt lacus at,7,2022-05-07
2544,congue vivamus metus arcu adipiscing,2,2022-02-04
2545,duis bibendum morbi non quam,3,2022-09-04
2546,eu massa donec dapibus duis,4,2021-12-16
2547,nunc viverra dapibus nulla suscipit,3,2022-02-18
2548,urna ut tellus nulla ut,7,2022-04-03
2549,ridiculus mus etiam vel augue vestibulum,6,2022-07-29
2550,leo odio porttitor id consequat in,2,2022-02-18
2551,nulla mollis molestie lorem quisque,7,2022-09-03
2552,commodo vulputate justo in blandit,3,2022-04-11
2553,viverra dapibus nulla suscipit ligula,2,2022-01-08
2554,et ultrices posuere cubilia curae,4,2022-09-09
2555,sit amet nunc viverra dapibus nulla,6,2022-06-22
2556,nunc viverra dapibus nulla suscipit ligula,3,2022-06-17
2557,sagittis sapien cum sociis natoque,2,2022-09-06
2558,massa quis augue luctus tincidunt nulla,3,2021-11-29
2559,ante vivamus tortor duis mattis egestas,6,2022-01-29
2560,ridiculus mus vivamus vestibulum sagittis,3,2022-01-03
2561,cursus vestibulum proin eu mi nulla,6,2022-09-02
2562,sapien urna pretium nisl ut,3,2022-01-05
2563,donec posuere metus vitae ipsum aliquam,4,2022-03-06
2564,nunc donec quis orci eget orci,6,2022-03-22
2565,pellentesque ultrices phasellus id sapien in,7,2022-01-24
2566,fusce posuere felis sed lacus,1,2022-02-10
2567,cubilia curae donec pharetra magna,3,2021-11-15
2568,sit amet lobortis sapien sapien,5,2022-07-24
2569,placerat ante nulla justo aliquam quis,3,2022-05-10
2570,nulla dapibus dolor vel est,6,2022-07-25
2571,nulla ut erat id mauris,6,2022-02-27
2572,varius nulla facilisi cras non,3,2022-10-20
2573,in imperdiet et commodo vulputate,1,2022-02-25
2574,sollicitudin mi sit amet lobortis,5,2022-04-20
2575,euismod scelerisque quam turpis adipiscing,7,2022-01-29
2576,nonummy maecenas tincidunt lacus at velit,4,2022-08-21
2577,ipsum primis in faucibus orci luctus,7,2022-10-29
2578,platea dictumst etiam faucibus cursus,3,2022-03-07
2580,odio odio elementum eu interdum,4,2022-03-23
2581,nascetur ridiculus mus etiam vel,7,2022-05-13
2582,mauris ullamcorper purus sit amet,3,2022-09-18
2583,tempus sit amet sem fusce consequat,4,2022-04-19
2584,tortor sollicitudin mi sit amet,5,2022-04-01
2585,id nisl venenatis lacinia aenean sit,2,2021-12-03
2586,viverra diam vitae quam suspendisse,1,2022-06-28
2587,interdum mauris ullamcorper purus sit,6,2022-01-12
2588,amet sapien dignissim vestibulum vestibulum,7,2022-05-20
2589,consectetuer adipiscing elit proin interdum mauris,4,2022-06-01
2590,semper est quam pharetra magna,4,2022-10-25
2591,imperdiet sapien urna pretium nisl ut,7,2022-04-09
2592,duis aliquam convallis nunc proin at,1,2022-07-06
2593,eu interdum eu tincidunt in leo,7,2022-01-20
2594,dapibus nulla suscipit ligula in,7,2022-02-17
2595,curabitur gravida nisi at nibh,6,2022-09-12
2596,cursus urna ut tellus nulla,6,2022-05-17
2597,lectus suspendisse potenti in eleifend quam,4,2022-06-26
2598,orci eget orci vehicula condimentum,1,2022-02-10
2599,donec ut dolor morbi vel lectus,4,2022-01-15
2600,imperdiet nullam orci pede venenatis non,3,2022-07-11
2601,sit amet eleifend pede libero,1,2022-05-11
2602,ipsum aliquam non mauris morbi non,5,2022-06-21
2603,ligula vehicula consequat morbi a ipsum,4,2022-07-03
2604,duis ac nibh fusce lacus,3,2022-06-12
2605,nam nulla integer pede justo lacinia,3,2022-01-04
2606,velit eu est congue elementum in,3,2022-03-16
2607,sit amet lobortis sapien sapien non,3,2022-04-17
2608,lorem ipsum dolor sit amet consectetuer,5,2022-05-03
2609,sem praesent id massa id,2,2022-05-02
2610,vitae nisi nam ultrices libero non,6,2022-03-14
2611,nulla suspendisse potenti cras in,1,2021-12-12
2612,platea dictumst morbi vestibulum velit id,1,2022-09-17
2613,integer pede justo lacinia eget,3,2022-06-09
2614,sit amet eleifend pede libero quis,1,2022-03-26
2615,diam nam tristique tortor eu,5,2022-08-04
2616,sit amet turpis elementum ligula,5,2022-04-01
2617,gravida nisi at nibh in,6,2022-07-17
2618,nunc nisl duis bibendum felis sed,7,2022-09-11
2619,in quis justo maecenas rhoncus aliquam,4,2022-02-24
2620,pede ac diam cras pellentesque,6,2022-10-16
2621,sed sagittis nam congue risus,4,2022-01-01
2622,luctus cum sociis natoque penatibus,5,2022-03-19
2623,venenatis turpis enim blandit mi in,3,2022-04-26
2624,faucibus orci luctus et ultrices,6,2021-11-25
2625,morbi non lectus aliquam sit,3,2022-03-13
2626,id ornare imperdiet sapien urna pretium,6,2022-03-28
2627,elementum ligula vehicula consequat morbi a,2,2022-03-30
2628,mattis odio donec vitae nisi nam,6,2022-09-06
2629,eleifend quam a odio in,4,2021-11-17
2630,nam congue risus semper porta volutpat,4,2022-03-05
2631,quam a odio in hac,2,2022-07-16
2632,in libero ut massa volutpat convallis,3,2022-06-12
2633,orci luctus et ultrices posuere cubilia,6,2022-04-05
2634,vestibulum ante ipsum primis in,1,2022-04-27
2635,a odio in hac habitasse,7,2022-07-17
2636,vitae nisl aenean lectus pellentesque eget,7,2022-01-19
2637,nec nisi volutpat eleifend donec ut,1,2022-01-30
2638,dui nec nisi volutpat eleifend donec,6,2022-01-17
2639,accumsan felis ut at dolor,5,2022-08-05
2640,eget vulputate ut ultrices vel augue,2,2022-07-23
2641,purus eu magna vulputate luctus cum,1,2022-03-01
2642,volutpat in congue etiam justo,1,2022-06-20
2643,rhoncus aliquet pulvinar sed nisl nunc,3,2022-05-17
2644,leo odio porttitor id consequat in,4,2022-04-30
2645,fusce consequat nulla nisl nunc,5,2022-06-05
2646,quis justo maecenas rhoncus aliquam,1,2022-05-01
2647,ante ipsum primis in faucibus orci,5,2022-10-26
2648,non mi integer ac neque,7,2022-10-10
2649,nibh fusce lacus purus aliquet at,1,2022-09-23
2650,at dolor quis odio consequat varius,1,2022-05-12
2651,faucibus orci luctus et ultrices,7,2022-07-14
2652,eu est congue elementum in hac,2,2022-08-12
2653,porttitor lacus at turpis donec posuere,7,2022-03-31
2654,pede ullamcorper augue a suscipit,1,2021-11-15
2655,at nunc commodo placerat praesent blandit,6,2022-09-26
2656,posuere cubilia curae duis faucibus accumsan,4,2022-03-21
2657,eget eros elementum pellentesque quisque porta,7,2022-09-25
2658,at vulputate vitae nisl aenean lectus,4,2022-01-04
2659,ridiculus mus etiam vel augue vestibulum,1,2022-06-11
2660,id ligula suspendisse ornare consequat,6,2022-01-24
2661,diam in magna bibendum imperdiet nullam,2,2022-10-07
2662,mauris morbi non lectus aliquam sit,6,2022-04-25
2663,sapien varius ut blandit non,5,2021-11-29
2664,blandit non interdum in ante vestibulum,6,2022-02-15
2665,luctus rutrum nulla tellus in,5,2022-02-03
2666,cras in purus eu magna vulputate,5,2022-03-05
2667,in lacus curabitur at ipsum ac,6,2022-03-03
2668,sed tincidunt eu felis fusce,6,2022-10-06
2669,id turpis integer aliquet massa id,3,2022-01-11
2670,in congue etiam justo etiam pretium,7,2022-10-15
2671,maecenas pulvinar lobortis est phasellus,3,2022-09-27
2672,consequat lectus in est risus auctor,5,2022-02-02
2673,luctus nec molestie sed justo,4,2022-03-24
2674,massa volutpat convallis morbi odio,5,2022-02-03
2675,justo aliquam quis turpis eget,5,2022-08-09
2676,maecenas tincidunt lacus at velit,5,2022-09-27
2677,vestibulum rutrum rutrum neque aenean,1,2021-12-10
2678,est congue elementum in hac habitasse,3,2022-02-06
2679,quis augue luctus tincidunt nulla,3,2022-04-28
2680,orci mauris lacinia sapien quis,2,2022-06-27
2681,lorem vitae mattis nibh ligula,6,2021-12-10
2682,in blandit ultrices enim lorem ipsum,3,2022-07-01
2683,sapien dignissim vestibulum vestibulum ante,2,2022-06-22
2684,dignissim vestibulum vestibulum ante ipsum primis,7,2022-06-05
2685,penatibus et magnis dis parturient montes,3,2022-07-10
2686,consectetuer adipiscing elit proin risus praesent,3,2021-11-22
2687,felis fusce posuere felis sed lacus,7,2022-01-28
2688,morbi non lectus aliquam sit amet,3,2022-01-27
2689,cras pellentesque volutpat dui maecenas tristique,3,2022-10-11
2690,nulla sed vel enim sit,2,2021-11-09
2691,ultrices vel augue vestibulum ante,1,2022-04-28
2692,eget vulputate ut ultrices vel augue,6,2022-07-07
2693,sem mauris laoreet ut rhoncus,7,2021-11-23
2694,lacus morbi quis tortor id,7,2022-04-22
2695,euismod scelerisque quam turpis adipiscing lorem,7,2022-02-19
2696,ac tellus semper interdum mauris,3,2022-09-05
2697,amet eros suspendisse accumsan tortor quis,5,2022-08-27
2698,dapibus duis at velit eu est,6,2022-01-28
2699,et eros vestibulum ac est lacinia,4,2022-05-08
2700,pede justo lacinia eget tincidunt,1,2022-03-06
2701,tellus nisi eu orci mauris,3,2022-01-21
2702,dapibus at diam nam tristique,2,2022-06-20
2703,erat fermentum justo nec condimentum neque,1,2022-08-04
2704,posuere nonummy integer non velit,3,2022-08-25
2705,lobortis est phasellus sit amet erat,4,2022-04-16
2706,nibh quisque id justo sit amet,2,2022-10-17
2707,vel nulla eget eros elementum,5,2022-06-26
2708,cubilia curae mauris viverra diam vitae,1,2021-11-21
2709,pede morbi porttitor lorem id,5,2022-08-18
2710,nulla pede ullamcorper augue a suscipit,1,2022-08-30
2711,vivamus vestibulum sagittis sapien cum sociis,4,2021-12-24
2712,varius ut blandit non interdum in,6,2022-09-21
2713,dapibus augue vel accumsan tellus,7,2021-11-01
2714,integer non velit donec diam neque,2,2022-01-09
2715,rutrum rutrum neque aenean auctor gravida,4,2021-11-14
2716,venenatis tristique fusce congue diam id,6,2022-09-06
2717,at lorem integer tincidunt ante,3,2022-07-11
2718,lacinia sapien quis libero nullam,4,2021-12-20
2719,molestie hendrerit at vulputate vitae,2,2022-06-18
2720,montes nascetur ridiculus mus etiam,5,2022-04-28
2721,blandit mi in porttitor pede justo,6,2022-03-20
2722,sollicitudin vitae consectetuer eget rutrum at,1,2022-09-03
2723,ut massa volutpat convallis morbi,4,2022-03-11
2724,eu tincidunt in leo maecenas pulvinar,4,2022-09-13
2725,quam sapien varius ut blandit,2,2022-02-23
2726,eros viverra eget congue eget,7,2022-01-22
2727,pellentesque at nulla suspendisse potenti,7,2022-02-04
2728,tortor sollicitudin mi sit amet lobortis,6,2022-10-27
2729,praesent blandit lacinia erat vestibulum,7,2022-05-12
2730,et ultrices posuere cubilia curae,1,2021-11-19
2731,quam pharetra magna ac consequat,3,2022-03-03
2732,aliquam quis turpis eget elit,4,2022-08-02
2733,nulla justo aliquam quis turpis,5,2021-11-14
2734,nunc rhoncus dui vel sem,7,2021-12-27
2735,magna vestibulum aliquet ultrices erat,5,2022-01-18
2736,condimentum neque sapien placerat ante nulla,3,2022-04-25
2737,volutpat sapien arcu sed augue aliquam,3,2021-12-27
2738,dis parturient montes nascetur ridiculus mus,1,2022-05-11
2739,id justo sit amet sapien,6,2022-06-16
2740,turpis sed ante vivamus tortor,3,2022-08-09
2741,quam turpis adipiscing lorem vitae mattis,2,2022-02-06
2742,odio in hac habitasse platea,2,2022-04-08
2743,ac nibh fusce lacus purus aliquet,1,2022-05-30
2744,ante nulla justo aliquam quis turpis,7,2022-01-26
2745,in hac habitasse platea dictumst,3,2022-01-20
2746,sit amet eleifend pede libero quis,4,2021-12-11
2747,mus etiam vel augue vestibulum,6,2022-07-13
2748,placerat ante nulla justo aliquam,3,2022-09-12
2749,sapien placerat ante nulla justo,2,2022-02-22
2750,eget congue eget semper rutrum nulla,1,2022-09-05
2751,eget eros elementum pellentesque quisque porta,1,2022-03-30
2752,posuere cubilia curae duis faucibus,1,2021-12-08
2753,mus vivamus vestibulum sagittis sapien,1,2021-12-08
2754,felis ut at dolor quis,2,2022-07-03
2755,nulla suscipit ligula in lacus,4,2022-10-20
2756,donec semper sapien a libero,2,2022-02-28
2757,diam erat fermentum justo nec condimentum,4,2022-03-12
2758,amet diam in magna bibendum,7,2022-02-06
2759,adipiscing elit proin risus praesent,7,2021-12-18
2760,rhoncus aliquam lacus morbi quis tortor,2,2022-03-25
2761,ut suscipit a feugiat et,6,2022-05-14
2762,id nulla ultrices aliquet maecenas leo,7,2022-03-30
2763,sed nisl nunc rhoncus dui vel,1,2022-02-16
2764,mauris sit amet eros suspendisse,6,2022-04-28
2765,tincidunt ante vel ipsum praesent blandit,7,2022-06-18
2766,vel enim sit amet nunc viverra,5,2022-05-28
2767,tortor quis turpis sed ante vivamus,1,2022-08-02
2768,tincidunt in leo maecenas pulvinar lobortis,5,2022-07-11
2769,volutpat quam pede lobortis ligula,3,2022-06-29
2770,posuere cubilia curae duis faucibus,2,2022-02-06
2771,leo odio condimentum id luctus nec,7,2021-11-06
2772,quis turpis sed ante vivamus,4,2022-01-19
2773,accumsan odio curabitur convallis duis consequat,2,2022-07-11
2774,eu mi nulla ac enim in,6,2022-02-16
2775,neque vestibulum eget vulputate ut,3,2022-05-14
2776,non velit nec nisi vulputate nonummy,6,2022-02-24
2777,duis aliquam convallis nunc proin at,5,2022-08-08
2778,morbi ut odio cras mi pede,7,2022-04-11
2779,venenatis tristique fusce congue diam id,6,2022-07-05
2780,platea dictumst morbi vestibulum velit id,4,2021-12-29
2781,condimentum curabitur in libero ut,2,2021-12-01
2782,nibh in lectus pellentesque at,2,2022-07-18
2783,amet justo morbi ut odio cras,5,2022-04-01
2784,et eros vestibulum ac est,3,2022-01-21
2785,mi pede malesuada in imperdiet et,2,2022-04-05
2786,nibh fusce lacus purus aliquet at,7,2022-08-20
2787,vestibulum proin eu mi nulla,5,2022-03-10
2788,semper porta volutpat quam pede,7,2022-05-21
2789,sit amet eros suspendisse accumsan tortor,3,2022-05-01
2790,magnis dis parturient montes nascetur,4,2022-10-18
2791,nisi volutpat eleifend donec ut dolor,2,2022-05-17
2792,amet eleifend pede libero quis,5,2022-06-06
2793,in sagittis dui vel nisl duis,6,2022-02-22
2794,nulla ac enim in tempor,1,2021-12-19
2795,consequat varius integer ac leo,7,2021-12-28
2796,montes nascetur ridiculus mus etiam vel,1,2021-12-17
2797,varius ut blandit non interdum in,1,2021-11-15
2798,natoque penatibus et magnis dis,3,2022-03-06
2799,amet sem fusce consequat nulla,1,2022-10-12
2800,non lectus aliquam sit amet diam,4,2022-08-15
2801,laoreet ut rhoncus aliquet pulvinar sed,7,2022-04-06
2802,mattis pulvinar nulla pede ullamcorper augue,2,2021-11-30
2803,lectus pellentesque eget nunc donec,6,2022-07-03
2804,fermentum donec ut mauris eget,5,2021-12-05
2805,morbi odio odio elementum eu interdum,5,2021-12-26
2806,nulla mollis molestie lorem quisque,2,2022-02-03
2807,congue diam id ornare imperdiet sapien,2,2021-12-04
2808,ipsum primis in faucibus orci,5,2022-09-04
2809,id ornare imperdiet sapien urna pretium,2,2022-07-06
2810,suscipit ligula in lacus curabitur at,6,2022-10-18
2811,accumsan odio curabitur convallis duis consequat,1,2022-09-14
2812,gravida nisi at nibh in hac,1,2022-04-01
2813,aliquam erat volutpat in congue,1,2022-09-28
2814,risus praesent lectus vestibulum quam,5,2021-12-05
2815,tempus semper est quam pharetra,4,2022-04-13
2816,maecenas tristique est et tempus semper,2,2022-09-28
2817,nec molestie sed justo pellentesque viverra,7,2022-04-01
2818,id lobortis convallis tortor risus,4,2022-02-02
2819,adipiscing elit proin risus praesent,5,2022-04-14
2820,nullam orci pede venenatis non,1,2022-01-04
2821,sit amet erat nulla tempus,7,2022-08-17
2822,elementum pellentesque quisque porta volutpat erat,7,2022-04-25
2823,duis mattis egestas metus aenean fermentum,3,2022-04-09
2824,etiam justo etiam pretium iaculis,5,2022-05-28
2825,mattis egestas metus aenean fermentum,2,2022-10-25
2826,ridiculus mus etiam vel augue,7,2022-09-06
2827,donec posuere metus vitae ipsum aliquam,5,2022-06-19
2828,metus vitae ipsum aliquam non,3,2022-08-16
2829,in faucibus orci luctus et ultrices,3,2022-05-30
2830,ut volutpat sapien arcu sed augue,4,2022-02-05
2831,interdum in ante vestibulum ante,7,2022-10-18
2832,et magnis dis parturient montes nascetur,3,2022-08-12
2833,adipiscing molestie hendrerit at vulputate vitae,1,2022-10-12
2834,mus etiam vel augue vestibulum,2,2022-09-02
2835,nisi nam ultrices libero non mattis,4,2022-01-16
2836,accumsan tortor quis turpis sed ante,1,2021-12-26
2837,interdum in ante vestibulum ante,5,2022-09-04
2838,consequat varius integer ac leo,3,2022-07-03
2839,enim leo rhoncus sed vestibulum sit,1,2022-09-07
2840,consequat nulla nisl nunc nisl,7,2022-02-03
2841,dui luctus rutrum nulla tellus,1,2022-07-26
2842,nisi at nibh in hac,2,2022-02-02
2843,varius ut blandit non interdum,3,2022-09-08
2844,vulputate elementum nullam varius nulla,3,2022-05-03
2845,arcu sed augue aliquam erat,3,2022-06-22
2846,integer a nibh in quis,4,2022-07-12
2847,velit nec nisi vulputate nonummy maecenas,7,2022-07-03
2848,in lacus curabitur at ipsum ac,4,2022-01-03
2849,donec dapibus duis at velit,4,2022-10-09
2850,orci vehicula condimentum curabitur in,4,2022-04-30
2851,lobortis convallis tortor risus dapibus,4,2021-11-08
2852,libero non mattis pulvinar nulla pede,3,2022-07-29
2853,eu sapien cursus vestibulum proin,4,2022-09-29
2854,at nibh in hac habitasse,5,2022-08-01
2855,sapien iaculis congue vivamus metus arcu,3,2022-04-26
2856,augue luctus tincidunt nulla mollis molestie,1,2022-04-28
2857,phasellus id sapien in sapien iaculis,1,2022-10-23
2858,elementum ligula vehicula consequat morbi,2,2022-04-18
2859,pellentesque ultrices mattis odio donec,4,2022-08-08
2860,ultrices posuere cubilia curae duis,2,2022-08-10
2861,cursus id turpis integer aliquet,2,2022-06-17
2862,fermentum donec ut mauris eget,6,2022-10-23
2863,lacinia sapien quis libero nullam sit,7,2021-11-28
2864,primis in faucibus orci luctus,6,2022-06-30
2865,id massa id nisl venenatis,2,2022-07-31
2866,suspendisse accumsan tortor quis turpis,6,2022-09-18
2867,faucibus cursus urna ut tellus,6,2021-12-11
2868,nulla elit ac nulla sed vel,5,2022-08-13
2869,tempus vivamus in felis eu,4,2022-09-01
2870,ultrices posuere cubilia curae nulla dapibus,5,2021-12-01
2871,nisi volutpat eleifend donec ut,3,2022-04-03
2872,donec posuere metus vitae ipsum aliquam,3,2022-08-17
2873,nibh ligula nec sem duis,7,2022-06-05
2874,non quam nec dui luctus rutrum,5,2022-02-23
2875,amet turpis elementum ligula vehicula consequat,3,2022-03-12
2876,dignissim vestibulum vestibulum ante ipsum primis,7,2022-04-04
2877,leo odio condimentum id luctus nec,7,2022-05-14
2878,orci pede venenatis non sodales,1,2022-05-15
2879,lorem ipsum dolor sit amet,3,2022-07-18
2880,nisl nunc rhoncus dui vel sem,7,2022-07-26
2881,et ultrices posuere cubilia curae,3,2022-02-21
2882,lacinia erat vestibulum sed magna,3,2022-05-04
2883,sapien ut nunc vestibulum ante ipsum,5,2022-02-11
2884,interdum venenatis turpis enim blandit mi,7,2021-11-22
2885,vehicula consequat morbi a ipsum,5,2022-10-22
2886,justo nec condimentum neque sapien,1,2022-09-10
2887,habitasse platea dictumst maecenas ut massa,7,2022-04-14
2888,pulvinar lobortis est phasellus sit,1,2022-08-26
2889,ut tellus nulla ut erat id,5,2022-02-05
4439,cras non velit nec nisi,6,2022-09-10
2890,etiam justo etiam pretium iaculis justo,5,2022-06-08
2891,donec pharetra magna vestibulum aliquet ultrices,1,2022-04-09
2892,metus sapien ut nunc vestibulum ante,6,2022-01-03
2893,et ultrices posuere cubilia curae,4,2022-04-17
2894,luctus tincidunt nulla mollis molestie lorem,1,2022-04-18
2895,sed tristique in tempus sit amet,5,2022-09-07
2896,donec pharetra magna vestibulum aliquet,4,2022-05-14
2897,nunc proin at turpis a pede,1,2022-08-11
2898,etiam justo etiam pretium iaculis justo,2,2022-03-21
2899,mus etiam vel augue vestibulum,7,2021-12-03
2900,amet justo morbi ut odio cras,3,2022-04-01
2901,morbi non quam nec dui luctus,1,2022-05-27
2902,in faucibus orci luctus et,5,2022-04-22
2903,sapien dignissim vestibulum vestibulum ante ipsum,7,2022-05-18
2904,libero rutrum ac lobortis vel dapibus,3,2022-06-26
2905,eleifend luctus ultricies eu nibh quisque,6,2022-06-20
2906,at velit eu est congue elementum,2,2022-02-21
2907,phasellus sit amet erat nulla tempus,1,2022-05-27
2908,interdum mauris non ligula pellentesque,7,2022-01-19
2909,ornare consequat lectus in est risus,2,2022-07-06
2910,pulvinar lobortis est phasellus sit amet,2,2022-03-27
2911,nulla suspendisse potenti cras in purus,7,2022-08-06
2912,quis turpis eget elit sodales,5,2022-05-14
2913,in faucibus orci luctus et,6,2022-06-29
2914,semper interdum mauris ullamcorper purus sit,6,2022-03-13
2915,congue etiam justo etiam pretium iaculis,4,2022-02-08
2916,fusce posuere felis sed lacus morbi,1,2022-10-12
2917,ligula nec sem duis aliquam,6,2022-03-31
2918,ante ipsum primis in faucibus orci,4,2022-06-21
2919,fusce consequat nulla nisl nunc,7,2022-02-06
2920,cras in purus eu magna vulputate,1,2022-05-23
2921,quisque erat eros viverra eget congue,6,2022-08-09
2922,semper rutrum nulla nunc purus,2,2022-09-01
2923,nunc nisl duis bibendum felis sed,7,2022-08-14
2924,ridiculus mus etiam vel augue vestibulum,5,2022-10-22
2925,ullamcorper augue a suscipit nulla,6,2021-12-24
2926,potenti nullam porttitor lacus at turpis,4,2022-10-14
2927,turpis nec euismod scelerisque quam turpis,2,2021-12-16
2928,nisi vulputate nonummy maecenas tincidunt,5,2022-04-09
2929,quis libero nullam sit amet turpis,4,2022-04-29
2930,odio odio elementum eu interdum eu,4,2022-08-24
2931,nulla ultrices aliquet maecenas leo,7,2022-02-20
2932,scelerisque quam turpis adipiscing lorem,2,2022-10-22
2933,nulla ac enim in tempor turpis,6,2022-05-31
2934,varius ut blandit non interdum,1,2022-02-21
2935,tempor convallis nulla neque libero,1,2021-11-22
2936,platea dictumst etiam faucibus cursus,1,2022-09-25
2937,nonummy maecenas tincidunt lacus at,2,2021-12-22
2938,mauris laoreet ut rhoncus aliquet,1,2022-10-30
2939,fusce congue diam id ornare,5,2022-02-14
2940,odio porttitor id consequat in consequat,3,2022-04-10
2941,odio elementum eu interdum eu,3,2022-03-11
2942,ante nulla justo aliquam quis,2,2022-10-16
2943,porttitor lorem id ligula suspendisse ornare,3,2022-10-29
